{"run":33,"commit":"f910f23","metric":0,"metrics":{"static_bug_checks":0,"typecheck_fail":0,"build_fail":0,"rust_check_fail":0},"status":"keep","description":"embed overlay as child of Among Us client area","timestamp":1777504759174,"segment":16,"confidence":null,"asi":{"hypothesis":"top-level overlay caused taskbar cover/disappear and visible overlay outside game; child-window overlay should be clipped to Among Us client area","overlay_fix":"Windows overlay now uses GetClientRect, SetParent to Among Us HWND, WS_CHILD style, and SetWindowPos at client 0,0; detaches when disabled/missing/minimized","validation":"static checks, npm typecheck, npm build, and cargo check pass","risk":"cross-process SetParent can behave differently with exclusive fullscreen; test in windowed/borderless first"}}
{"type":"config","name":"Perfect Crewlink non-topmost embedded overlay","metricName":"bug_score","metricUnit":"","bestDirection":"lower"}
{"run":34,"commit":"6d100a4","metric":1,"metrics":{"static_bug_checks":1,"typecheck_fail":0,"build_fail":0,"rust_check_fail":0},"status":"keep","description":"baseline for removing topmost overlay flags after child embedding","timestamp":1777504968275,"segment":17,"confidence":null,"asi":{"hypothesis":"even after SetParent child embedding, overlay is still created/configured topmost and may race visible as a top-level taskbar-covering window","user_feedback":"taskbar disappeared while app was open","new_check":"overlay lib/config should not set topmost true once embedded child window is used"}}
{"run":35,"commit":"6c734fd","metric":0,"metrics":{"static_bug_checks":0,"typecheck_fail":0,"build_fail":0,"rust_check_fail":0},"status":"keep","description":"disable topmost flags for embedded overlay window","timestamp":1777505114158,"segment":17,"confidence":null,"asi":{"hypothesis":"removing always-on-top from embedded overlay prevents taskbar-covering races while child-parent embedding keeps overlay inside Among Us","overlay_fix":"configure_overlay_window sets always_on_top(false); tauri overlay window config alwaysOnTop=false","validation":"static checks, npm typecheck, npm build, and cargo check pass","next_action_hint":"rebuild installer/exe for testing; if overlay disappears behind exclusive fullscreen, test borderless/windowed or investigate DirectComposition/in-process overlay approaches"}}
{"type":"config","name":"Perfect Crewlink child overlay z-order","metricName":"bug_score","metricUnit":"","bestDirection":"lower"}
{"run":36,"commit":"e469308","metric":1,"metrics":{"static_bug_checks":1,"typecheck_fail":0,"build_fail":0,"rust_check_fail":0},"status":"keep","description":"baseline for child overlay z-order check","timestamp":1777505235803,"segment":18,"confidence":null,"asi":{"hypothesis":"embedded overlay may be a child window but still render behind Among Us content unless moved to top of the child z-order","next_action_hint":"use HWND_TOP in SetWindowPos and remove SWP_NOZORDER for embedded overlay sizing","validation":"existing checks pass except new z-order check"}}
{"run":37,"commit":"732d273","metric":0,"metrics":{"static_bug_checks":0,"typecheck_fail":0,"build_fail":0,"rust_check_fail":0},"status":"keep","description":"raise embedded overlay to top of Among Us child z-order","timestamp":1777505321843,"segment":18,"confidence":null,"asi":{"hypothesis":"after removing topmost, embedded child overlay may render behind the game unless explicitly raised to top of the parent child z-order","overlay_fix":"SetWindowPos now uses Some(HWND_TOP) and removes SWP_NOZORDER while keeping SWP_NOACTIVATE|SWP_FRAMECHANGED","validation":"static checks, npm typecheck, npm build, and cargo check pass","next_action_hint":"rebuild exe before testing; if taskbar issue persists, inspect owner/parent transitions and detach timing"}}
{"type":"config","name":"Perfect Crewlink overlay detach visibility","metricName":"bug_score","metricUnit":"","bestDirection":"lower"}
{"run":38,"commit":"7e1986d","metric":1,"metrics":{"static_bug_checks":1,"typecheck_fail":0,"build_fail":0,"rust_check_fail":0},"status":"keep","description":"baseline for overlay detach visibility check","timestamp":1777505457968,"segment":19,"confidence":null,"asi":{"hypothesis":"when overlay is disabled or Among Us disappears, code detaches a visible child overlay back to top-level before hiding, which can briefly cover taskbar/outside game","new_check":"hide overlay before Windows detach and stop forcing WS_VISIBLE during detach","validation":"existing checks pass except new detach visibility check","next_action_hint":"add hide_overlay_window helper, call it on disabled/missing/minimized paths, and only force WS_VISIBLE for child embedding"}}
{"run":39,"commit":"7e1986d","metric":1,"metrics":{"static_bug_checks":1,"typecheck_fail":0,"build_fail":0,"rust_check_fail":0},"status":"discard","description":"attempt hide-before-detach but static check missed helper on CRLF files","timestamp":1777505536929,"segment":19,"confidence":null,"asi":{"hypothesis":"hide overlay before detach and avoid forcing WS_VISIBLE when detaching should prevent visible top-level flashes","rollback_reason":"benchmark regex used newline-only function matching and failed to detect the helper in CRLF Rust source, so primary metric did not improve despite intended code change","next_action_hint":"fix the detach visibility check to be CRLF-tolerant, rerun baseline, then reapply the hide-before-detach product change","validation":"typecheck, build, and cargo check still passed"}}
{"type":"config","name":"Perfect Crewlink overlay detach visibility check fix","metricName":"bug_score","metricUnit":"","bestDirection":"lower"}
{"run":40,"commit":"be1e92c","metric":1,"metrics":{"static_bug_checks":1,"typecheck_fail":0,"build_fail":0,"rust_check_fail":0},"status":"keep","description":"baseline with CRLF-safe overlay detach visibility check","timestamp":1777505613341,"segment":20,"confidence":null,"asi":{"hypothesis":"detach visibility root cause remains: overlay is detached while still styled visible, so it can flash as top-level window","benchmark_fix":"updated helper extraction to use index/slice instead of LF-only regex so CRLF Rust files are handled","validation":"baseline still fails only new detach visibility check","next_action_hint":"reapply hide-before-detach and clear WS_VISIBLE when detaching"}}
{"run":41,"commit":"85fb7bb","metric":0,"metrics":{"static_bug_checks":0,"typecheck_fail":0,"build_fail":0,"rust_check_fail":0},"status":"keep","description":"hide overlay before detach and avoid forcing visible popup style","timestamp":1777505663727,"segment":20,"confidence":null,"asi":{"hypothesis":"hiding before detach and clearing WS_VISIBLE when detaching prevents embedded overlay from flashing as a top-level popup outside Among Us or over taskbar","overlay_fix":"added hide_overlay_window helper for disabled/missing/minimized paths; detach path no longer ORs WS_VISIBLE into popup style","validation":"static checks, npm typecheck, npm build, and cargo check pass","next_action_hint":"review SetParent style order next: Windows docs recommend setting WS_CHILD before SetParent when assigning a non-null parent"}}
{"type":"config","name":"Perfect Crewlink SetParent child style order","metricName":"bug_score","metricUnit":"","bestDirection":"lower"}
{"run":42,"commit":"3061054","metric":1,"metrics":{"static_bug_checks":1,"typecheck_fail":0,"build_fail":0,"rust_check_fail":0},"status":"keep","description":"baseline for SetParent child style order","timestamp":1777505769450,"segment":21,"confidence":null,"asi":{"hypothesis":"SetParent called before WS_CHILD/WS_POPUP style changes can create transient top-level overlay behavior or unreliable child embedding; Windows docs recommend setting WS_CHILD before assigning a parent","new_check":"set_overlay_child_styles must set WS_CHILD before SetParent for child embedding","validation":"existing overlay, meeting, voice, typecheck, build, and cargo checks pass except new style-order check","next_action_hint":"branch set_overlay_child_styles so parent Some sets child style before SetParent, while detach keeps hide-first behavior"}}
{"run":43,"commit":"9622b70","metric":0,"metrics":{"static_bug_checks":0,"typecheck_fail":0,"build_fail":0,"rust_check_fail":0},"status":"keep","description":"set child window style before SetParent embedding","timestamp":1777505808476,"segment":21,"confidence":null,"asi":{"hypothesis":"setting WS_CHILD before SetParent avoids transient top-level overlay behavior and follows Windows SetParent style guidance for cross-process child embedding","overlay_fix":"set_overlay_child_styles now sets WS_CHILD/clears WS_POPUP before SetParent(Some(parent)); detach still hides first, then SetParent(None), then clears WS_CHILD/WS_VISIBLE","validation":"static checks, npm typecheck, npm build, and cargo check pass","next_action_hint":"consider applying SWP_FRAMECHANGED on detach style changes too, since current detach passes size=None and therefore does not call SetWindowPos after changing WS_CHILD/WS_POPUP"}}
{"type":"config","name":"Perfect Crewlink detach framechanged style apply","metricName":"bug_score","metricUnit":"","bestDirection":"lower"}
{"run":44,"commit":"d617f21","metric":1,"metrics":{"static_bug_checks":1,"typecheck_fail":0,"build_fail":0,"rust_check_fail":0},"status":"keep","description":"baseline for detach SWP_FRAMECHANGED style apply","timestamp":1777505909093,"segment":22,"confidence":null,"asi":{"hypothesis":"detach changes WS_CHILD/WS_POPUP/WS_VISIBLE but passes size=None, so no SetWindowPos(SWP_FRAMECHANGED) runs to apply the frame/style changes immediately","new_check":"set_overlay_child_styles must call SetWindowPos with SWP_NOMOVE|SWP_NOSIZE|SWP_NOZORDER|SWP_NOACTIVATE|SWP_FRAMECHANGED when size is None","validation":"existing overlay, meeting, voice, typecheck, build, and cargo checks pass except new detach framechanged check","next_action_hint":"add size=None SetWindowPos path after detach style changes"}}
{"run":45,"commit":"d617f21","metric":1,"metrics":{"static_bug_checks":1,"typecheck_fail":0,"build_fail":0,"rust_check_fail":0},"status":"discard","description":"attempt detach framechanged but z-order check overmatched detach flags","timestamp":1777505949575,"segment":22,"confidence":null,"asi":{"hypothesis":"calling SetWindowPos(SWP_FRAMECHANGED) on detach should apply WS_CHILD/WS_POPUP style changes immediately","rollback_reason":"existing child z-order static check overmatched the new detach-only SWP_NOZORDER flag sequence, so primary metric did not improve even though the intended new check passed","next_action_hint":"narrow overlay_child_z_order_top check to the size Some embedding SetWindowPos block, then rerun baseline and reapply detach framechanged fix","validation":"typecheck, build, and cargo check passed"}}
{"type":"config","name":"Perfect Crewlink detach framechanged check narrowing","metricName":"bug_score","metricUnit":"","bestDirection":"lower"}
{"run":46,"commit":"a7861cb","metric":1,"metrics":{"static_bug_checks":1,"typecheck_fail":0,"build_fail":0,"rust_check_fail":0},"status":"keep","description":"baseline with narrowed child z-order check","timestamp":1777506035396,"segment":23,"confidence":null,"asi":{"hypothesis":"detach framechanged root cause remains; benchmark z-order check should only reject SWP_NOZORDER in the size/embedding SetWindowPos block, not the detach-only framechanged path","benchmark_fix":"overlay_child_z_order_top now inspects only the if-let-size SetWindowPos block","validation":"baseline still fails only detach framechanged check","next_action_hint":"reapply detach SetWindowPos(SWP_FRAMECHANGED) path"}}
{"run":47,"commit":"b304955","metric":0,"metrics":{"static_bug_checks":0,"typecheck_fail":0,"build_fail":0,"rust_check_fail":0},"status":"keep","description":"apply framechanged after detach style updates","timestamp":1777506065412,"segment":23,"confidence":null,"asi":{"hypothesis":"after detaching and changing WS_CHILD/WS_POPUP/WS_VISIBLE, SetWindowPos(SWP_FRAMECHANGED) should run even without a resize so Windows applies the new top-level hidden style immediately","overlay_fix":"size=None path now calls SetWindowPos with SWP_NOMOVE|SWP_NOSIZE|SWP_NOZORDER|SWP_NOACTIVATE|SWP_FRAMECHANGED; embed size path still raises with HWND_TOP and no SWP_NOZORDER","validation":"static checks, npm typecheck, npm build, and cargo check pass","next_action_hint":"inspect whether detach path should preserve previous parent state to avoid redundant SetParent(None) calls, but only if runtime testing shows flicker"}}
{"type":"config","name":"Perfect Crewlink redundant SetParent guard","metricName":"bug_score","metricUnit":"","bestDirection":"lower"}
{"run":48,"commit":"a99747c","metric":1,"metrics":{"static_bug_checks":1,"typecheck_fail":0,"build_fail":0,"rust_check_fail":0},"status":"keep","description":"baseline for skipping redundant SetParent calls","timestamp":1777506241467,"segment":24,"confidence":null,"asi":{"hypothesis":"refreshing overlay while already embedded repeatedly calls SetParent and can cause avoidable z-order/style churn or flicker during Alt-Tab/resizes","new_check":"set_overlay_child_styles should read current parent with GetParent and call SetParent only when parent changes; detach should skip SetParent(None) if already unparented","validation":"existing overlay, meeting, voice, typecheck, build, and cargo checks pass except new redundant SetParent check","next_action_hint":"import GetParent, compute current_parent once, guard SetParent(Some(parent_hwnd)) and SetParent(None)"}}
{"run":49,"commit":"83fdc16","metric":0,"metrics":{"static_bug_checks":0,"typecheck_fail":0,"build_fail":0,"rust_check_fail":0},"status":"keep","description":"skip redundant SetParent calls during overlay refresh","timestamp":1777506282182,"segment":24,"confidence":null,"asi":{"hypothesis":"avoiding repeated SetParent calls when overlay is already parented/unparented reduces z-order/style churn and flicker while keeping child embedding intact","overlay_fix":"set_overlay_child_styles reads current parent with GetParent; SetParent(Some(parent)) only runs when parent differs, and SetParent(None) only runs when a parent exists","validation":"static checks, npm typecheck, npm build, and cargo check pass","next_action_hint":"runtime-test Alt-Tab/window resize; if flicker persists, collect traces around refresh_overlay_window call frequency before adding more guards"}}
{"type":"config","name":"Perfect Crewlink stale audio cleanup without peer connection","metricName":"bug_score","metricUnit":"","bestDirection":"lower"}
{"run":50,"commit":"6e63369","metric":1,"metrics":{"static_bug_checks":1,"typecheck_fail":0,"build_fail":0,"rust_check_fail":0},"status":"keep","description":"baseline for stale audio cleanup when peer connection missing","timestamp":1777506512993,"segment":25,"confidence":null,"asi":{"hypothesis":"if disconnectPeer is called after the Peer object was already removed but audio elements/monitors still exist, the no-connection branch returns before disconnectAudioElement, leaving stale audio activity and talking highlights","new_check":"disconnectPeer no-connection branch must call disconnectAudioElement(peer) before return","validation":"existing overlay, meeting, voice, typecheck, build, and cargo checks pass except new stale-audio cleanup check","next_action_hint":"call disconnectAudioElement(peer) in the !connection branch after client state cleanup and before return"}}
{"run":51,"commit":"bd43b1d","metric":0,"metrics":{"static_bug_checks":0,"typecheck_fail":0,"build_fail":0,"rust_check_fail":0},"status":"keep","description":"clean stale audio when disconnecting missing peer connection","timestamp":1777506572865,"segment":25,"confidence":null,"asi":{"hypothesis":"if the Peer object is already gone but audio elements/monitors remain, the no-connection branch should still tear down audio to prevent stale activity and wrong talking highlights","voice_fix":"disconnectPeer now calls disconnectAudioElement(peer) before returning from the !connection branch","validation":"static checks, npm typecheck, npm build, and cargo check pass","next_action_hint":"inspect preserveClientState duplicate-socket path for whether audio cleanup can clear active replacement state; current cleanup only clears monitor state when active socket is absent or equals peer"}}
{"type":"config","name":"Perfect Crewlink VAD socket-mapped client identity","metricName":"bug_score","metricUnit":"","bestDirection":"lower"}
{"run":52,"commit":"f917217","metric":1,"metrics":{"static_bug_checks":1,"typecheck_fail":0,"build_fail":0,"rust_check_fail":0},"status":"keep","description":"baseline for socket-mapped VAD client identity","timestamp":1777520645802,"segment":26,"confidence":null,"asi":{"hypothesis":"remaining meeting highlights can be wrong when VAD payload carries a stale client id for a socket; highlight state should use the locally mapped socket->client identity instead of trusting data.client.clientId","user_feedback":"highlighting still wrong for some players; can highlight dead players or another player with the speaker color","new_check":"VAD handler must derive vadClientId from socketClientsRef.current[data.socketId]?.clientId before falling back to data.client.clientId, and use it for stale guard, otherVAD, and client connection updates","validation":"existing overlay, meeting, voice, typecheck, build, and cargo checks pass except new VAD identity check"}}
{"run":53,"commit":"40bae95","metric":0,"metrics":{"static_bug_checks":0,"typecheck_fail":0,"build_fail":0,"rust_check_fail":0},"status":"keep","description":"map VAD activity through active socket client identity","timestamp":1777520678548,"segment":26,"confidence":null,"asi":{"hypothesis":"using locally known socket->client mapping for VAD prevents stale server payload client ids from lighting up a dead/wrong player card","voice_fix":"VAD handler now computes vadClientId from socketClientsRef.current[data.socketId]?.clientId ?? data.client.clientId and uses it for stale guard, otherVAD, and connection updates","user_feedback_addressed":"wrong highlights for subset of players, especially dead/wrong-color highlights","validation":"static checks, npm typecheck, npm build, and cargo check pass","next_action_hint":"build installer and test meeting highlights again; if bug remains, inspect overlay color/name mapping for shiftedColor/nameHash collisions"}}
{"type":"config","name":"Perfect Crewlink audio monitor socket-mapped client identity","metricName":"bug_score","metricUnit":"","bestDirection":"lower"}
{"run":54,"commit":"0577a25","metric":1,"metrics":{"static_bug_checks":1,"typecheck_fail":0,"build_fail":0,"rust_check_fail":0},"status":"keep","description":"baseline for audio monitor socket-mapped client identity","timestamp":1777520866854,"segment":27,"confidence":null,"asi":{"hypothesis":"remaining wrong highlights can come from audio analyser monitors created with an initial client id; if socket->client mapping changes later, audio activity keeps updating the old/dead player's client id","user_feedback":"highlighting improved but still wrong for some players, including dead/wrong-color highlights","new_check":"startPeerAudioMonitor must resolve active client id from socketClientsRef.current[peer]?.clientId on every interval, update monitor.clientId when it changes, and write audio activity to monitor.clientId","validation":"existing checks, typecheck, build, and cargo checks pass except new audio monitor mapping check"}}
{"run":55,"commit":"4e27856","metric":0,"metrics":{"static_bug_checks":0,"typecheck_fail":0,"build_fail":0,"rust_check_fail":0},"status":"keep","description":"keep audio monitor activity on active socket client mapping","timestamp":1777520934268,"segment":27,"confidence":null,"asi":{"hypothesis":"audio analyser monitors can outlive initial client mapping; resolving socket->client each interval prevents monitor audio from updating old/dead player's talking state","voice_fix":"startPeerAudioMonitor now re-reads socketClientsRef.current[peer]?.clientId, clears old client audio activity when mapping changes, updates monitor.clientId, and writes audio activity/connection state to monitor.clientId","user_feedback_addressed":"wrong highlights for remaining subset of players after VAD socket mapping fix","validation":"static checks, npm typecheck, npm build, and cargo check pass","next_action_hint":"build installer before runtime test; if highlights remain wrong, inspect overlay color/name resolution for shiftedColor/nameHash collisions or stale overlay bootstrap state"}}
{"type":"config","name":"Perfect Crewlink voice activity requires mapped sockets","metricName":"bug_score","metricUnit":"","bestDirection":"lower"}
{"run":56,"commit":"69819f5","metric":2,"metrics":{"static_bug_checks":2,"typecheck_fail":0,"build_fail":0,"rust_check_fail":0},"status":"keep","description":"baseline for requiring mapped socket identity before voice activity updates","timestamp":1777521168208,"segment":28,"confidence":null,"asi":{"hypothesis":"remaining wrong highlights can come from fallback paths that trust stale client ids when socket->client mapping is missing; unmapped VAD/audio monitor activity should be ignored instead of assigned to old/dead players","new_checks":["VAD handler must require socketClientsRef.current[data.socketId] before updating otherVAD","audio monitor must require socketClientsRef.current[peer]?.clientId before writing audio activity"],"validation":"existing checks, typecheck, build, and cargo checks pass except two new mapped-socket checks","next_action_hint":"remove data.client and monitor.clientId fallbacks, clear old monitor activity when mapping is absent, then rerun"}}
