{"run":57,"commit":"ed4103d","metric":0,"metrics":{"static_bug_checks":0,"typecheck_fail":0,"build_fail":0,"rust_check_fail":0},"status":"keep","description":"ignore voice activity from unmapped sockets","timestamp":1777521227604,"segment":28,"confidence":null,"asi":{"hypothesis":"fallback client ids for unmapped sockets can assign VAD/audio monitor activity to old or dead players; ignoring unmapped socket activity is safer than highlighting the wrong card","voice_fix":"VAD now returns when socketClientsRef has no mapping for data.socketId; audio monitor now clears existing activity and returns when socketClientsRef has no mapping for peer, and resets monitor state when mapping changes","user_feedback_addressed":"residual wrong highlights on dead/wrong player cards after previous mapping fixes","validation":"static checks, npm typecheck, npm build, and cargo check pass","next_action_hint":"build installer before testing; if highlights remain wrong, inspect meeting overlay slot ordering or color source (colorId vs shiftedColor)"}}
{"type":"config","name":"Perfect Crewlink highlight and audio simulations","metricName":"bug_score","metricUnit":"","bestDirection":"lower"}
{"run":58,"commit":"7372c9a","metric":1,"metrics":{"static_bug_checks":0,"simulation_failures":1,"typecheck_fail":0,"build_fail":0,"rust_check_fail":0},"status":"keep","description":"baseline with highlight and audio simulation harness","timestamp":1777522466762,"segment":29,"confidence":null,"asi":{"hypothesis":"explicit simulations should catch remaining highlight regressions: deaths during meetings, disconnect placeholders, same-length replacements, color swaps, dead-player talking guards, and top-down audio axes","simulation_coverage":["meeting death keeps slot order","disconnect keeps placeholder slot","same-length replacement appends","color/swapper identity keeps slot","dead remote should not highlight for alive local","dead remote can highlight for dead local","audio top-down x/z axis mapping"],"failure":"Overlay meeting highlight source lacks dead/disconnected guard for alive local user, so stale talking state can still light dead player cards","next_action_hint":"add isMeetingPlayerTalking helper in Overlay.tsx and use it for meeting overlay opacity/debug, gating dead/disconnected remote players when localIsAlive is true"}}
{"run":59,"commit":"45fc29a","metric":0,"metrics":{"static_bug_checks":0,"simulation_failures":0,"typecheck_fail":0,"build_fail":0,"rust_check_fail":0},"status":"keep","description":"suppress dead remote meeting highlights for alive local player","timestamp":1777522560881,"segment":29,"confidence":null,"asi":{"hypothesis":"even with voice state cleanup, stale talking flags can reach the overlay; meeting overlay should defensively refuse to highlight dead/disconnected remote players while the local player is alive","highlight_fix":"added isMeetingPlayerTalking helper and used it for meeting overlay opacity/debug; it gates player.isDead, player.disconnected, and voiceState.otherDead[player.clientId] when voiceState.localIsAlive is true","simulation_coverage":"death during meeting, disconnect placeholders, same-length replacement, color/swapper identity, dead-player highlight guard, and top-down audio axes all pass","validation":"simulation harness, static checks, npm typecheck, npm build, and cargo check pass","next_action_hint":"move to audio immersion simulations next: distance rolloff, camera hearing, wall blocking, vent/radio muffling, and directional panner smoothing"}}
{"type":"config","name":"Perfect Crewlink audio smoothing simulation","metricName":"bug_score","metricUnit":"","bestDirection":"lower"}
{"run":60,"commit":"dfc9ccf","metric":1,"metrics":{"static_bug_checks":0,"simulation_failures":1,"typecheck_fail":0,"build_fail":0,"rust_check_fail":0},"status":"keep","description":"baseline for smoothed directional audio simulation","timestamp":1777522682188,"segment":30,"confidence":null,"asi":{"hypothesis":"directional audio is accurate on X/Z axes but position and gain jump abruptly; smoothing panner/gain AudioParams should reduce zippering/pops and make movement more immersive","simulation_added":"audio_smoothing_moves_toward_target_without_overshoot plus source checks for smoothed panner X/Y/Z and gain updates","failure":"Voice.tsx still writes PannerNode positions and GainNode values immediately instead of scheduling smoothed AudioParam changes","next_action_hint":"add setSmoothedAudioParam/setSmoothedGain helpers using setTargetAtTime or linear ramps, then replace direct pan/gain assignments"}}
{"run":61,"commit":"0344bd9","metric":0,"metrics":{"static_bug_checks":0,"simulation_failures":0,"typecheck_fail":0,"build_fail":0,"rust_check_fail":0},"status":"keep","description":"smooth panner and gain audio parameters","timestamp":1777522731048,"segment":30,"confidence":null,"asi":{"hypothesis":"smoothing PannerNode position and GainNode changes reduces abrupt directional jumps, zipper noise, and volume pops while preserving top-down spatial accuracy","audio_fix":"added AUDIO_PARAM_SMOOTHING_SECONDS, setSmoothedAudioParam, and setSmoothedGain; directional X/Y/Z panner updates and per-peer gain updates now use smoothed AudioParam scheduling","simulation_coverage":"highlight scenarios plus audio x/z axes, distance preservation, and no-overshoot smoothing source checks pass","validation":"simulation harness, static checks, npm typecheck, npm build, and cargo check pass","next_action_hint":"next audio iteration: simulate distance rolloff/near-field scaling, camera hearing, wall blocking, vent/radio muffling, and tune attenuation for immersive proximity"}}
{"type":"config","name":"Perfect Crewlink immersive HRTF directional audio","metricName":"bug_score","metricUnit":"","bestDirection":"lower"}
{"run":62,"commit":"0836d07","metric":1,"metrics":{"static_bug_checks":0,"simulation_failures":1,"typecheck_fail":0,"build_fail":0,"rust_check_fail":0},"status":"keep","description":"baseline for HRTF directional panning simulation","timestamp":1777522827717,"segment":31,"confidence":null,"asi":{"hypothesis":"equalpower panning gives weaker left/right/front/back cues than HRTF; HRTF panning should improve directional immersion while preserving existing top-down coordinates","simulation_added":"source_audio_uses_hrtf_panning requires pan.panningModel='HRTF'","failure":"Voice.tsx still configures remote PannerNode with panningModel='equalpower'","next_action_hint":"switch PannerNode panningModel to HRTF, rerun simulations/typecheck/build/cargo"}}
{"run":63,"commit":"5972c98","metric":0,"metrics":{"static_bug_checks":0,"simulation_failures":0,"typecheck_fail":0,"build_fail":0,"rust_check_fail":0},"status":"keep","description":"use HRTF panning for immersive directional audio","timestamp":1777522857985,"segment":31,"confidence":null,"asi":{"hypothesis":"HRTF panning improves perceived directionality over equalpower stereo panning for top-down proximity audio without changing peer mapping or coordinate math","audio_fix":"remote PannerNode now uses pan.panningModel='HRTF' while keeping top-down X/Z coordinate mapping and smoothed AudioParam updates","simulation_coverage":"highlight death/disconnect/swapper scenarios, mapped voice activity, top-down axes, smoothing, and HRTF source checks pass","validation":"simulation harness, static checks, npm typecheck, npm build, and cargo check pass","next_action_hint":"next audio iteration: simulate/tune distance attenuation curve and near/far falloff, then test vent/camera/radio muffling behavior"}}
{"type":"config","name":"Perfect Crewlink effective audio max-distance attenuation","metricName":"bug_score","metricUnit":"","bestDirection":"lower"}
{"run":64,"commit":"3c95bfa","metric":1,"metrics":{"static_bug_checks":0,"simulation_failures":1,"typecheck_fail":0,"build_fail":0,"rust_check_fail":0},"status":"keep","description":"baseline for effective max-distance attenuation simulation","timestamp":1777522940052,"segment":32,"confidence":null,"asi":{"hypothesis":"audio distance attenuation should use the current effective max distance after vision, camera, and vent modifiers; leaving PannerNode.maxDistance at the lobby default makes camera/vent/range attenuation less accurate","simulation_added":"source_audio_uses_effective_maxdistance requires pan.maxDistance = maxdistance in calculateVoiceAudio","failure":"Voice.tsx computes maxdistance but does not push the final value into PannerNode before panning","next_action_hint":"assign pan.maxDistance = maxdistance after all maxdistance modifiers and before setTopDownPanPosition"}}
{"run":65,"commit":"ed07b6c","metric":0,"metrics":{"static_bug_checks":0,"simulation_failures":0,"typecheck_fail":0,"build_fail":0,"rust_check_fail":0},"status":"keep","description":"apply effective max distance to panner attenuation","timestamp":1777522983972,"segment":32,"confidence":null,"asi":{"hypothesis":"PannerNode distance attenuation should match the effective range after camera/vent/vision modifiers, not stale lobby maxDistance","audio_fix":"calculateVoiceAudio now assigns pan.maxDistance = maxdistance after all maxdistance adjustments and before smoothed top-down pan positioning","simulation_coverage":"highlight scenarios, HRTF, smoothing, top-down axes, and effective max-distance checks pass","validation":"simulation harness, static checks, npm typecheck, npm build, and cargo check pass","next_action_hint":"next audio iteration: simulate/tune distance model/refDistance/rolloff curve for better near/far loudness while preserving hard max range"}}
{"type":"config","name":"Perfect Crewlink near-field audio reference distance","metricName":"bug_score","metricUnit":"","bestDirection":"lower"}
{"run":66,"commit":"9935a66","metric":1,"metrics":{"static_bug_checks":0,"simulation_failures":1,"typecheck_fail":0,"build_fail":0,"rust_check_fail":0},"status":"keep","description":"baseline for near-field reference distance simulation","timestamp":1777523062760,"segment":33,"confidence":null,"asi":{"hypothesis":"PannerNode refDistance=0.1 makes volume start attenuating from an unrealistically tiny range; a small near-field reference distance should make nearby players sound stable and natural while distance still falls off to max range","simulation_added":"source_audio_uses_near_field_ref_distance requires AUDIO_NEAR_FIELD_DISTANCE and pan.refDistance assignment","failure":"Voice.tsx hardcodes pan.refDistance = 0.1","next_action_hint":"add AUDIO_NEAR_FIELD_DISTANCE constant around 0.6 and assign pan.refDistance from it"}}
{"run":67,"commit":"ec95040","metric":0,"metrics":{"static_bug_checks":0,"simulation_failures":0,"typecheck_fail":0,"build_fail":0,"rust_check_fail":0},"status":"keep","description":"add near-field reference distance for stable close audio","timestamp":1777523098819,"segment":33,"confidence":null,"asi":{"hypothesis":"nearby players should stay naturally full-volume within a small radius before linear falloff begins; refDistance 0.6 is a better close-field distance than 0.1 for Among Us map units","audio_fix":"added AUDIO_NEAR_FIELD_DISTANCE=0.6 and uses it for PannerNode.refDistance with HRTF, smoothing, and effective maxDistance","simulation_coverage":"highlight scenarios plus HRTF, smoothing, effective maxDistance, top-down axes, and near-field refDistance checks pass","validation":"simulation harness, static checks, npm typecheck, npm build, and cargo check pass","next_action_hint":"build/test; if audio feels too loud up close or too quiet far away, tune AUDIO_NEAR_FIELD_DISTANCE by runtime feedback"}}
{"type":"config","name":"Perfect Crewlink smooth muffled audio filter transitions","metricName":"bug_score","metricUnit":"","bestDirection":"lower"}
{"run":68,"commit":"a0044e2","metric":1,"metrics":{"static_bug_checks":0,"simulation_failures":1,"typecheck_fail":0,"build_fail":0,"rust_check_fail":0},"status":"keep","description":"baseline for smoothed muffle filter simulation","timestamp":1777523303791,"segment":34,"confidence":null,"asi":{"hypothesis":"vent/camera muffling switches BiquadFilterNode frequency and Q instantly, causing audible clicks or zippering when entering vents/cameras; smoothing these filter params should improve immersion","simulation_added":"source_audio_smooths_muffle_filter requires muffle.frequency and muffle.Q to use setSmoothedAudioParam and rejects direct .value writes","failure":"Voice.tsx still writes muffle.frequency.value and muffle.Q.value directly","next_action_hint":"replace direct muffle filter AudioParam value writes with setSmoothedAudioParam calls, then rerun full harness"}}
{"run":69,"commit":"a0044e2","metric":4,"metrics":{"static_bug_checks":3,"simulation_failures":1,"typecheck_fail":0,"build_fail":0,"rust_check_fail":0},"status":"discard","description":"attempt muffle filter smoothing but editor formatter rewrote Voice.tsx","timestamp":1777523354868,"segment":34,"confidence":null,"asi":{"hypothesis":"smoothing muffle frequency and Q should reduce clicks when vent/camera muffling toggles","rollback_reason":"edit tool auto-formatted large parts of Voice.tsx from single quotes to double quotes, breaking existing static source checks unrelated to intended audio change; intended muffle regex also missed formatted output","failure_details":"static checks failed for vad_requires_socket_mapped_client_id, connect_refreshes_same_lobby_ids, connect_effect_tracks_player_identity; source_audio_smooths_muffle_filter still failed","next_action_hint":"reapply only two exact byte replacements with python to avoid auto-formatting: muffle.frequency.value -> setSmoothedAudioParam(muffle.frequency, ...), muffle.Q.value -> setSmoothedAudioParam(muffle.Q, ...)"}}
{"run":70,"commit":"59ba843","metric":0,"metrics":{"static_bug_checks":0,"simulation_failures":0,"typecheck_fail":0,"build_fail":0,"rust_check_fail":0},"status":"keep","description":"smooth muffle filter audio parameters","timestamp":1777523392183,"segment":34,"confidence":null,"asi":{"hypothesis":"smoothing vent/camera muffling filter frequency and Q reduces clicks/zippering when muffled audio toggles without changing muffle ranges or voice routing","audio_fix":"replaced direct muffle.frequency.value and muffle.Q.value writes with setSmoothedAudioParam for radio highpass setup and vent/camera lowpass transitions","simulation_coverage":"highlight death/disconnect/swapper scenarios plus top-down axes, smoothing, HRTF, effective maxDistance, near-field refDistance, and muffle filter smoothing checks pass","validation":"static checks, simulation harness, npm typecheck, Vite production build, and cargo check pass","next_action_hint":"next audio iteration: add a simulation for smoothing muffle gain on connect/disconnect or verify directional listener orientation remains stable across movement updates"}}
{"type":"config","name":"Perfect Crewlink explicit vent camera lowpass muffle","metricName":"bug_score","metricUnit":"","bestDirection":"lower"}
{"run":71,"commit":"289a34f","metric":1,"metrics":{"static_bug_checks":0,"simulation_failures":1,"typecheck_fail":0,"build_fail":0,"rust_check_fail":0},"status":"keep","description":"baseline for explicit vent camera lowpass simulation","timestamp":1777523526301,"segment":35,"confidence":null,"asi":{"hypothesis":"the shared muffle BiquadFilter can be switched to highpass by impostor radio and later reused for vent/camera muffling; vent/camera branch should explicitly set lowpass so stale radio state cannot make muffled proximity audio wrong","simulation_added":"source_audio_sets_vent_camera_lowpass_type scopes to the // Muffling in vents block and requires muffle.type='lowpass' there","failure":"Voice.tsx only initializes the muffle node as lowpass and sets radio highpass, but the vent/camera branch does not reassert lowpass before applying the filter","next_action_hint":"set muffle.type = 'lowpass' inside the vent/camera muffling branch before applyEffect/param smoothing"}}
{"run":72,"commit":"49714c6","metric":0,"metrics":{"static_bug_checks":0,"simulation_failures":0,"typecheck_fail":0,"build_fail":0,"rust_check_fail":0},"status":"keep","description":"reset vent and camera muffling to lowpass","timestamp":1777523551052,"segment":35,"confidence":null,"asi":{"hypothesis":"explicitly setting vent/camera muffling to lowpass prevents stale impostor-radio highpass state from making proximity muffling inaccurate or harsh","audio_fix":"added muffle.type='lowpass' inside the vent/camera muffling branch before connecting/smoothing the filter","simulation_coverage":"highlight death/disconnect/swapper scenarios plus top-down axes, HRTF, smoothing, effective maxDistance, near-field refDistance, muffle smoothing, and vent/camera lowpass checks pass","validation":"static checks, simulation harness, npm typecheck, Vite production build, and cargo check pass","next_action_hint":"next audio iteration: inspect effect connect/restore behavior; shared muffle node still cannot represent radio highpass and vent/camera lowpass simultaneously, so consider separate filter nodes only if runtime proves conflict"}}
{"type":"config","name":"Perfect Crewlink disconnected meeting highlight suppression","metricName":"bug_score","metricUnit":"","bestDirection":"lower"}
{"run":73,"commit":"bcaf323","metric":1,"metrics":{"static_bug_checks":0,"simulation_failures":1,"typecheck_fail":0,"build_fail":0,"rust_check_fail":0},"status":"keep","description":"baseline for disconnected meeting highlight simulation","timestamp":1777523645339,"segment":36,"confidence":null,"asi":{"hypothesis":"disconnected players should never show as talking in meeting overlays, even for dead local players; stale talking state after disconnect can otherwise light the wrong or missing card","simulation_added":"meeting_disconnected_remote_never_highlighted covers a disconnected remote speaker while localIsAlive=false and stale otherTalking=true","failure":"Overlay isMeetingPlayerTalking only suppresses dead/disconnected remotes when voiceState.localIsAlive is true","next_action_hint":"add an unconditional disconnected remote guard before the localIsAlive dead-player guard"}}
{"run":74,"commit":"bcaf323","metric":1,"metrics":{"static_bug_checks":0,"simulation_failures":1,"typecheck_fail":0,"build_fail":0,"rust_check_fail":0},"status":"discard","description":"attempt disconnected meeting highlight guard with incomplete simulation harness","timestamp":1777523704980,"segment":36,"confidence":null,"asi":{"hypothesis":"disconnected remote players should never show as talking in meeting overlays, including when local player is dead","rollback_reason":"product fix was correct direction but simulation helper still encoded the old behavior and no source check targeted the new guard, so primary metric did not improve","failure_details":"meeting_disconnected_remote_never_highlighted continued to fail because expectedMeetingTalking in scripts/simulate-highlight-audio.mjs still allowed disconnected remotes when localIsAlive=false","next_action_hint":"correct the simulation helper to model disconnected remotes as never talking, add a source check for the explicit disconnected guard, then reapply the Overlay.tsx guard"}}
{"type":"config","name":"Perfect Crewlink disconnected meeting highlight source guard","metricName":"bug_score","metricUnit":"","bestDirection":"lower"}
{"run":75,"commit":"e86a782","metric":1,"metrics":{"static_bug_checks":0,"simulation_failures":1,"typecheck_fail":0,"build_fail":0,"rust_check_fail":0},"status":"keep","description":"baseline for disconnected remote meeting source guard","timestamp":1777523767178,"segment":37,"confidence":null,"asi":{"hypothesis":"disconnected remote players should never show as talking in meeting overlays; source should contain an explicit disconnected-remote guard independent of local alive/dead state","simulation_added":"expectedMeetingTalking now models disconnected remotes as never talking and source_meeting_highlight_filters_disconnected_remote requires an explicit guard in Overlay.tsx","failure":"Overlay isMeetingPlayerTalking lacks the explicit if (!player.isLocal && player.disconnected) return false guard","next_action_hint":"add the disconnected remote guard before computing playerDead in isMeetingPlayerTalking"}}
{"run":76,"commit":"8463218","metric":0,"metrics":{"static_bug_checks":0,"simulation_failures":0,"typecheck_fail":0,"build_fail":0,"rust_check_fail":0},"status":"keep","description":"suppress disconnected remote meeting highlights","timestamp":1777523798696,"segment":37,"confidence":null,"asi":{"hypothesis":"disconnected remote players should never be highlighted as talking in meeting overlays, even when the local player is dead and stale otherTalking state remains","highlight_fix":"isMeetingPlayerTalking now returns false for non-local disconnected players before applying dead-player logic","simulation_coverage":"meeting death, disconnect placeholder, same-length replacement, color swapper, dead remote alive/dead local, disconnected remote stale talking, plus audio simulations all pass","validation":"static checks, simulation harness, npm typecheck, Vite production build, and cargo check pass","next_action_hint":"next audio iteration: investigate applyEffect/restoreEffect tolerance when reverb and muffle effects overlap, or separate filters if radio highpass and vent/camera lowpass can be active together"}}
{"type":"config","name":"Perfect Crewlink TOU Mira cosmetic icon resolution","metricName":"bug_score","metricUnit":"","bestDirection":"lower"}
