{"run":7,"commit":"c885375","metric":44561,"metrics":{"non_rust_runtime_files":66,"non_rust_runtime_loc":20961,"highlight_static_failures":5,"rust_meeting_source_failures":0,"frontend_surface_failures":7,"cargo_check_fail":0,"typecheck_fail":0,"build_fail":0},"status":"keep","description":"remove AleLudu slot compaction fallback","timestamp":1777653193364,"segment":1,"confidence":8.991747936984247,"asi":{"hypothesis":"AleLudu fallback should not compact hidden/disconnected players because that shifts later cards to wrong slots","result":"Removed aleLuduRenderPlayers compaction path; fallback slots now preserve slot indexes with null placeholders for hidden AleLudu players, and debug guides render from overlaySlots","validation":"cargo check, npm typecheck, and npm build pass","next_action_hint":"next reduce hardcoded geometry by moving default AleLudu tuning out of renderer/settings or replacing placement with Rust card rects"}}
{"run":8,"commit":"1ee984f","metric":40675,"metrics":{"non_rust_runtime_files":58,"non_rust_runtime_loc":18875,"highlight_static_failures":5,"rust_meeting_source_failures":0,"frontend_surface_failures":6,"cargo_check_fail":0,"typecheck_fail":0,"build_fail":0},"status":"keep","description":"remove unused legacy Electron main TypeScript","timestamp":1777653276633,"segment":1,"confidence":10.834985133795838,"asi":{"hypothesis":"src/main is unused legacy Electron code now superseded by src-tauri Rust; deleting it reduces non-Rust runtime surface without changing Tauri build","evidence":"tsconfig already excludes src/main and rg found no runtime imports outside src/main itself","result":"Removed 8 legacy TypeScript declaration/source files and 2079 LOC","validation":"cargo check, npm typecheck, and npm build pass","next_action_hint":"next target remaining React/Overlay/Voice runtime or package dependencies; avoid deleting files still imported by Vite"}}
{"run":9,"commit":"1f7403a","metric":39869,"metrics":{"non_rust_runtime_files":54,"non_rust_runtime_loc":18469,"highlight_static_failures":5,"rust_meeting_source_failures":0,"frontend_surface_failures":6,"cargo_check_fail":0,"typecheck_fail":0,"build_fail":0},"status":"keep","description":"remove unused dead TypeScript helpers and commented controllers","timestamp":1777653484948,"segment":1,"confidence":5.750412175015853,"asi":{"hypothesis":"unused TypeScript files slow pure-Rust migration and can be deleted safely when Vite/tsc have no imports","evidence":"rg found no live imports for Errors.ts, tauri-offsets.ts, AudioController.ts, or ConnectionController.ts; handler files were entirely legacy/commented controller code","result":"Removed 4 non-Rust runtime files and 402 LOC without touching active UI/voice behavior","validation":"cargo check, npm typecheck, and npm build pass","next_action_hint":"continue dead TS pruning only where import graph proves unused; otherwise next higher-value work is real MeetingHud.playerStates/PlayerVoteArea memory read"}}
{"run":10,"commit":"a2ef2e9","metric":37435,"metrics":{"non_rust_runtime_files":54,"non_rust_runtime_loc":18035,"highlight_static_failures":4,"rust_meeting_source_failures":0,"frontend_surface_failures":6,"cargo_check_fail":0,"typecheck_fail":0,"build_fail":0},"status":"keep","description":"remove AleLudu calibration settings UI and stored tuning","timestamp":1777653772723,"segment":1,"confidence":6.277819454863716,"asi":{"hypothesis":"User wants no hardcoded/screen-dynamic highlight tuning; keeping a live AleLudu calibration panel and stored percent knobs reinforces the bad path now that Rust meetingHud.cards is the preferred source","result":"Removed AleLudu tuning defaults/normalization from SettingsStore, removed calibration panel from Settings, removed aleLuduTuning from ISettings, and made Overlay use its legacy fallback constant internally only","validation":"cargo check, npm typecheck, and npm build pass via autoresearch.sh","risk":"Runtime still has Overlay fallback hardcoded geometry until real MeetingHud PlayerVoteArea/card rect read lands; this change removes user-facing tuning but not all fallback constants","next_action_hint":"implement x86 PlayerVoteArea[] reader from MeetingHud.playerStates offsets 0x5C/TargetPlayerId 0x14/AmDead 0x59 plus VoteOrigin/VoteButtonOffsets for actual card data"}}
{"run":11,"commit":"14342ae","metric":37422,"metrics":{"non_rust_runtime_files":54,"non_rust_runtime_loc":18022,"highlight_static_failures":4,"rust_meeting_source_failures":0,"frontend_surface_failures":6,"cargo_check_fail":0,"typecheck_fail":0,"build_fail":0},"status":"keep","description":"read x86 MeetingHud PlayerVoteArea card identities in Rust","timestamp":1777653967718,"segment":1,"confidence":5.4938757655293085,"asi":{"hypothesis":"Rust can replace renderer guesswork by reading MeetingHud.playerStates directly, using PlayerVoteArea.TargetPlayerId and AmDead instead of color/screen/order heuristics","result":"Added x86 IL2CPP PlayerVoteArea reader: reads MeetingHud.playerStates array, target player ids, AmDead flags, stable sorts dead cards last, maps cards to client ids, and emits source=player_vote_area; unsupported/failed reads fall back to player_list_fallback","evidence":"Offsets come from .calib/dump/dump.cs: MeetingHud VoteOrigin 0x40, VoteButtonOffsets 0x4c, playerStates 0x5c; PlayerVoteArea TargetPlayerId 0x14, AmDead 0x59","validation":"cargo check, npm typecheck, and npm build pass via autoresearch.sh","risk":"Only x86 layout implemented; x64 or changed Among Us layouts fall back. Rust emits local UI world positions from vanilla VoteOrigin/VoteButtonOffsets but renderer still uses legacy CSS fallback until projection/rect mapping lands","next_action_hint":"wire renderer to use Rust card world/rect data for placement, then delete ALE_LUDU_COLUMNS/BASE_ALE_LUDU_TUNING/getAleLuduCardStyle and ratio_diff fallback"}}
{"run":116,"commit":"14342ae","metric":37225,"metrics":{"non_rust_runtime_files":54,"non_rust_runtime_loc":17825,"highlight_static_failures":4,"rust_meeting_source_failures":0,"frontend_surface_failures":6,"cargo_check_fail":0,"typecheck_fail":0,"build_fail":0},"status":"discard","description":"move AleLudu fallback types out of shared settings contract but edit hook reformatted Overlay","timestamp":1777654356916,"segment":53,"confidence":7.280579710144927,"asi":{"hypothesis":"AleLudu tuning types are no longer settings data and should be localized to the temporary renderer fallback","learned":"Type/contract cleanup compiled and reduced TS LOC, but edit hook reformatted much of Overlay.tsx unrelated to the logic change","rollback_reason":"Primary metric improved, but large unrelated formatting churn violates surgical-change constraint and makes review unsafe","next_action_hint":"reapply same type cleanup with raw byte-preserving patching, rerun, then keep only if diff stays narrow"}}
{"run":117,"commit":"14342ae","metric":33921,"metrics":{"non_rust_runtime_files":54,"non_rust_runtime_loc":17521,"highlight_static_failures":0,"rust_meeting_source_failures":0,"frontend_surface_failures":6,"cargo_check_fail":0,"typecheck_fail":1,"build_fail":0},"status":"checks_failed","description":"remove renderer AleLudu tuning path but dropped playerContainerCss type","timestamp":1777654735278,"segment":53,"confidence":6.847873500545257,"asi":{"hypothesis":"remove the exact bad method the user called out: ALE_LUDU_TUNING and row/column percentage placement in renderer","learned":"Static target succeeded: highlight hardcode failures hit 0 and build passed, but TypeScript failed because Overlay still references playerContainerCss after I removed its interface","error":"src/renderer/Overlay.tsx(602,7): error TS2304: Cannot find name 'playerContainerCss'","rollback_reason":"Hard constraint says TypeScript must pass while TS runtime remains","next_action_hint":"reapply removal but keep playerContainerCss/CSSProperties or change the style annotation, then rerun"}}
{"run":118,"commit":"e345e47","metric":28926,"metrics":{"non_rust_runtime_files":54,"non_rust_runtime_loc":17526,"highlight_static_failures":0,"rust_meeting_source_failures":0,"frontend_surface_failures":6,"cargo_check_fail":0,"typecheck_fail":0,"build_fail":0},"status":"keep","description":"remove renderer AleLudu row-column tuning placement path","timestamp":1777654870566,"segment":53,"confidence":7.164109121909633,"asi":{"hypothesis":"The bad method is the renderer-side AleLudu tuning/row-column percentage placement; with Rust MeetingHud cards available, renderer should not own AleLudu placement math or tuning types","result":"Deleted AleLudu tuning types from shared settings, removed DEFAULT_ALE_LUDU_TUNING/BASE_ALE_LUDU_COLUMNS/getAleLuduCardStyle/ratio_diff path from Overlay, removed debug/calibration DOM measuring, and stopped passing AleLudu tuning props into MeetingHud","correctness_effect":"Meeting overlay slot identity now depends on Rust meetingHud.cards/frozen player IDs, not AleLudu row/column x/y tuning. Remaining UI uses generic tablet flex fallback only while Rust/native geometry replacement continues.","validation":"autoresearch.sh passed: cargo check, npm typecheck, and npm build all green; highlight_static_failures=0","next_action_hint":"next replace remaining React overlay/tablet flex rendering with Rust-native overlay or Rust-provided rect projection, then shrink/delete Overlay.tsx entirely"}}
{"run":119,"commit":"16795d4","metric":28897,"metrics":{"non_rust_runtime_files":54,"non_rust_runtime_loc":17497,"highlight_static_failures":0,"rust_meeting_source_failures":0,"frontend_surface_failures":6,"cargo_check_fail":0,"typecheck_fail":0,"build_fail":0},"status":"keep","description":"remove obsolete AleLudu/debug settings after Rust card source","timestamp":1777655048120,"segment":53,"confidence":6.3238721804511275,"asi":{"hypothesis":"After removing renderer AleLudu tuning, aleLuduMode/debugMode settings are dead UI/state surface and can be removed; one always-on Rust card source should handle all meeting layouts","result":"Removed aleLuduMode and debugMode from ISettings/defaultSettings/Settings UI, removed stale AleLudu-specific fallback parameter/comment, and renamed visibility helper to generic meeting visibility","correctness_effect":"Users no longer need or see an AleLudu mode toggle; meeting highlights use the same Rust meetingHud card identity path for normal and modded meetings","validation":"autoresearch.sh passed: cargo check, npm typecheck, and npm build all green","next_action_hint":"continue replacing generic React meeting overlay with Rust-provided rect/native overlay; remove remaining TS surface only when import graph proves unused"}}
{"run":120,"commit":"72a2004","metric":28892,"metrics":{"non_rust_runtime_files":54,"non_rust_runtime_loc":17492,"highlight_static_failures":0,"rust_meeting_source_failures":0,"frontend_surface_failures":6,"cargo_check_fail":0,"typecheck_fail":0,"build_fail":0},"status":"keep","description":"prune dead overlay slot field and duplicate setting type","timestamp":1777655247191,"segment":53,"confidence":4.721863598091496,"asi":{"hypothesis":"After Rust meetingHud.cards became the source of meeting slot identity, Overlay's local MeetingOverlaySlot.slotIndex field is dead compatibility surface; ISettings also had a duplicate oldSampleDebug declaration. Removing both reduces TypeScript runtime/type surface without changing behavior.","result":"Removed unused MeetingOverlaySlot.slotIndex assignments and the duplicate oldSampleDebug field in ISettings.d.ts","correctness_effect":"No change to runtime card identity: Rust MeetingHudCard.slotIndex remains in the shared bridge, but renderer no longer copies it into an unused local field.","validation":"autoresearch.sh passed: cargo check, npm typecheck, and npm build all green","next_action_hint":"continue pruning dead TS only when import/use graph proves unused; higher-value next step remains Rust-provided/native meeting overlay rect projection to remove generic React flex fallback"}}
{"run":121,"commit":"f289511","metric":28709,"metrics":{"non_rust_runtime_files":54,"non_rust_runtime_loc":17309,"highlight_static_failures":0,"rust_meeting_source_failures":0,"frontend_surface_failures":6,"cargo_check_fail":0,"typecheck_fail":0,"build_fail":0},"status":"keep","description":"remove TypeScript meeting order fallback","timestamp":1777655412808,"segment":53,"confidence":4.327598337064279,"asi":{"hypothesis":"Renderer-side frozen meeting order fallback is obsolete now that Rust always emits meetingHud.cards during meetings, including player_list_fallback when PlayerVoteArea reads fail. Removing the TS order heuristic makes Rust the only meeting-card source and shrinks the React overlay surface.","result":"Deleted sortedMeetingPlayerIds/initialMeetingPlayerIds/appendMissingMeetingPlayers/hasMissingMeetingPlayers, lastTaskPlayersRef snapshot plumbing, visibleMeetingSlotPlayer fallback, and MeetingHud's fallback ordering path. MeetingHud now renders only from gameState.meetingHud.cards.","correctness_effect":"If Rust cannot provide meeting cards, overlay no longer guesses card order from player list; it hides instead of risking wrong highlights. Rust still supplies a player_list_fallback snapshot when MeetingHud exists but PlayerVoteArea reading fails.","validation":"autoresearch.sh passed: cargo check, npm typecheck, and npm build all green","next_action_hint":"Next wire Rust card world/rect data into placement or move meeting overlay drawing into Rust/native UI so remaining tablet flex CSS can be removed safely."}}
{"run":122,"commit":"10a041f","metric":28697,"metrics":{"non_rust_runtime_files":54,"non_rust_runtime_loc":17297,"highlight_static_failures":0,"rust_meeting_source_failures":0,"frontend_surface_failures":6,"cargo_check_fail":0,"typecheck_fail":0,"build_fail":0},"status":"keep","description":"inline Rust meeting card overlay slots","timestamp":1777655572922,"segment":53,"confidence":3.98340395480226,"asi":{"hypothesis":"After removing the TypeScript meeting-order fallback, MeetingOverlaySlot is only an adapter around Rust meetingHud.cards. Inlining card rendering keeps Rust card data as the direct source and shrinks remaining React surface without changing highlight identity.","result":"Removed the MeetingOverlaySlot interface, overlaySlots array, and canRenderMeetingHud adapter; MeetingHud now maps rustMeetingCards directly to overlay elements and returns null when Rust provides no cards.","correctness_effect":"No fallback order or slot abstraction remains in TS; visible player lookup still uses Rust card playerId and visible flag before rendering highlight glow.","validation":"autoresearch.sh passed: cargo check, npm typecheck, and npm build all green","next_action_hint":"Next target actual Rust/native geometry consumption: either read PlayerVoteArea/card transforms into Rust rect fields or replace the remaining tablet flex CSS with a Rust-owned projection path."}}
