{"type":"config","name":"Perfect Crewlink BetterCrewLink-style audio panning","metricName":"bug_score","metricUnit":"","bestDirection":"lower"}
{"run":94,"commit":"3b83950","metric":6,"metrics":{"static_bug_checks":0,"simulation_failures":6,"cosmetic_failures":0,"typecheck_fail":0,"build_fail":0,"rust_check_fail":0},"status":"keep","description":"baseline for BetterCrewLink-style audio panning","timestamp":1777584347690,"segment":46,"confidence":null,"asi":{"hypothesis":"remaining buzz/static and exaggerated left/right edge perception may come from HRTF panning plus added directional focus; upstream BetterCrewLink uses simpler equalpower panning, x/y position axes, fixed z=-0.5, refDistance=0.1, and rolloffFactor=1","upstream_reference":"git show upstream/nightly:src/renderer/Voice.tsx shows pan.panningModel='equalpower', pan.refDistance=0.1, pan.rolloffFactor=1, positionX=panPos[0], positionY=panPos[1], positionZ=-0.5","user_evidence":"user reports voices sound like they are at screen edges even when slightly offset, and buzz/glitch/static persists after muffle graph and limiter fixes","simulation_added":"BetterCrewLink-style panner checks for equalpower, x/y fixed-depth axes, exact maxDistance, refDistance=0.1, and no AUDIO_DIRECTIONAL_FOCUS","failures":"source_audio_uses_bettercrewlink_xy_fixed_depth_axes, source_audio_smooths_pan_and_gain, source_audio_uses_bettercrewlink_equalpower_panning, source_audio_uses_effective_maxdistance, source_audio_uses_bettercrewlink_ref_distance, source_audio_not_overfocused_directionally","validation":"baseline still passes static checks, existing overlay/audio/cosmetic simulations, typecheck, build, and cargo check","next_action_hint":"switch panner config and position updates to upstream BetterCrewLink style while preserving smoothing, vision cap, safe muffles, and limiter"}}
{"run":95,"commit":"478ab25","metric":0,"metrics":{"static_bug_checks":0,"simulation_failures":0,"cosmetic_failures":0,"typecheck_fail":0,"build_fail":0,"rust_check_fail":0},"status":"keep","description":"switch to BetterCrewLink-style panning","timestamp":1777584421704,"segment":46,"confidence":null,"asi":{"hypothesis":"HRTF plus directional focus over-spatializes nearby players and may add phasey/static artifacts; upstream BetterCrewLink's equalpower panner with x/y axes and fixed z depth is less aggressive and proven stable","audio_fix":"Voice.tsx now uses BetterCrewLink-style pan.refDistance=0.1, panningModel='equalpower', rolloffFactor=1, pan position X=panPos[0], Y=panPos[1], Z=-0.5, and pan.maxDistance=maxdistance without directional focus scaling","preserved_fixes":"kept vision hearing hard cap, smoothed params/gain, separate radio/environment muffle filters, permanent muffle chain, output limiter, socket-mapped activity, and AleLudu meeting slot compaction","validation":"overlay/voice static checks, highlight/audio simulations with BetterCrewLink panner checks, cosmetic simulations, npm typecheck, Vite build, and cargo check all pass","next_action_hint":"build installer and test nearby lateral movement plus radio/vent/camera audio; if buzzing remains, next compare upstream by bypassing reverb and limiter separately to isolate remaining coloration"}}
{"type":"config","name":"Perfect Crewlink AleLudu edge highlight slots","metricName":"bug_score","metricUnit":"","bestDirection":"lower"}
{"run":96,"commit":"bfe1072","metric":1,"metrics":{"static_bug_checks":0,"simulation_failures":1,"cosmetic_failures":0,"typecheck_fail":0,"build_fail":0,"rust_check_fail":0},"status":"keep","description":"baseline for AleLudu hidden edge slot shifts","timestamp":1777585013956,"segment":47,"confidence":null,"asi":{"hypothesis":"AleLudu highlights that are wrong around row edges or next to dead cards may be shifted by hidden disconnected/bugged/dummy players still consuming overlay slots even though the meeting UI does not draw them","user_evidence":"user reports most AleLudu cards highlight correctly, but edge cards and cards next to dead players still map to wrong people","simulation_added":"meeting_aleludu_hidden_players_do_not_shift_edges and source_meeting_aleludu_skips_hidden_players","failure":"source_meeting_aleludu_skips_hidden_players","validation":"baseline passes existing checks, audio panning checks, typecheck, build, and cargo check","next_action_hint":"filter disconnected/bugged/dummy players out of AleLudu slot rendering/debug slot counts while leaving vanilla placeholder behavior unchanged"}}
{"run":97,"commit":"11d7e0d","metric":0,"metrics":{"static_bug_checks":0,"simulation_failures":0,"cosmetic_failures":0,"typecheck_fail":0,"build_fail":0,"rust_check_fail":0},"status":"keep","description":"skip hidden AleLudu players for meeting slots","timestamp":1777585103999,"segment":47,"confidence":null,"asi":{"hypothesis":"AleLudu edge and next-to-dead highlight offsets come from disconnected, bugged, or dummy players consuming overlay slot indices even though AleLudu does not render them as cards","overlay_fix":"added isVisibleAleLuduMeetingPlayer and use aleLuduRenderPlayers for AleLudu overlay slots, debug guides, measured refs, and row count; vanilla meeting overlay still keeps frozen placeholder slots","expected_runtime_effect":"cards after hidden/disconnected/bugged entries should no longer be shifted, especially across row edges and near dead/removed players","validation":"overlay/voice static checks, highlight/audio simulations including hidden AleLudu slot shift check, cosmetic simulations, npm typecheck, Vite build, and cargo check all pass","next_action_hint":"build installer and test the edge/dead-neighbor cards; if still off, next target should be AleLudu column/row calibration or actual UI slot order captured from debug overlay"}}
{"type":"config","name":"Perfect Crewlink AleLudu pre-dead meeting order","metricName":"bug_score","metricUnit":"","bestDirection":"lower"}
{"run":98,"commit":"d73e347","metric":1,"metrics":{"static_bug_checks":0,"simulation_failures":1,"cosmetic_failures":0,"typecheck_fail":0,"build_fail":0,"rust_check_fail":0},"status":"keep","description":"baseline for AleLudu pre-dead meeting order","timestamp":1777585380859,"segment":48,"confidence":null,"asi":{"hypothesis":"AleLudu cards appear to use raw reader order even when players were already dead before the meeting; current overlay sorts pre-dead players to the end on TASKS->DISCUSSION, shifting edge cards and cards near dead players","user_evidence":"after hidden-player compaction, user still reports edge cards and cards next to dead players highlight the wrong neighbor","simulation_added":"meeting_aleludu_predead_transition_keeps_reader_order plus source check requiring AleLudu initial order to use raw reader order while vanilla still sorts pre-dead players alive-first","failure":"source_meeting_aleludu_initial_order_uses_reader_order","validation":"baseline passes existing static checks, highlight/audio simulations except new source check, cosmetic checks, typecheck, build, and cargo check","next_action_hint":"add aleLuduMode parameter to initialMeetingPlayerIds and pass aleLuduColumns > 0 so AleLudu uses raw reader order even on TASKS->DISCUSSION"}}
{"run":99,"commit":"d73e347","metric":2,"metrics":{"static_bug_checks":0,"simulation_failures":2,"cosmetic_failures":0,"typecheck_fail":0,"build_fail":0,"rust_check_fail":0},"status":"discard","description":"attempt AleLudu raw pre-dead order but source checks were formatter-brittle","timestamp":1777585514811,"segment":48,"confidence":null,"asi":{"hypothesis":"AleLudu should use raw reader order even across TASKS->DISCUSSION when players are already dead before the meeting","attempted_fix":"added aleLuduMode parameter to initialMeetingPlayerIds and passed aleLuduColumns > 0","rollback_reason":"primary metric worsened because source checks were over-specific and failed on formatter-wrapped multiline calls/renderPlayers.filter; product code compiled and runtime hypothesis still looks promising","failure":"source_meeting_aleludu_skips_hidden_players and source_meeting_aleludu_initial_order_uses_reader_order","validation":"typecheck/build/cargo passed","next_action_hint":"make source checks whitespace-tolerant, rerun baseline, then reapply the same AleLudu initial order fix"}}
{"type":"config","name":"Perfect Crewlink AleLudu pre-dead meeting order source checks","metricName":"bug_score","metricUnit":"","bestDirection":"lower"}
{"run":100,"commit":"ad28dba","metric":1,"metrics":{"static_bug_checks":0,"simulation_failures":1,"cosmetic_failures":0,"typecheck_fail":0,"build_fail":0,"rust_check_fail":0},"status":"keep","description":"baseline with robust AleLudu pre-dead source checks","timestamp":1777585659312,"segment":49,"confidence":null,"asi":{"hypothesis":"AleLudu should use raw reader order when pre-dead players exist at meeting start; source checks must tolerate formatter line wrapping","benchmark_fix":"made hidden-player and AleLudu initial-order source checks whitespace-tolerant so formatter wrapping does not create false failures","failure":"source_meeting_aleludu_initial_order_uses_reader_order","validation":"baseline passes hidden-player source check, existing simulations, audio checks, cosmetic checks, typecheck, build, and cargo check","next_action_hint":"reapply aleLuduMode parameter to initialMeetingPlayerIds and pass aleLuduColumns > 0"}}
{"run":101,"commit":"1558de4","metric":0,"metrics":{"static_bug_checks":0,"simulation_failures":0,"cosmetic_failures":0,"typecheck_fail":0,"build_fail":0,"rust_check_fail":0},"status":"keep","description":"use raw reader order for AleLudu pre-dead meetings","timestamp":1777585759898,"segment":49,"confidence":null,"asi":{"hypothesis":"AleLudu cards use raw reader order even when players were already dead before meeting start; alive-first sorting on TASKS->DISCUSSION shifts highlights near dead cards and row edges","overlay_fix":"initialMeetingPlayerIds now takes aleLuduMode; AleLudu uses raw players.map(id) order regardless of oldGameState, while vanilla keeps alive-first sorting for TASKS->DISCUSSION and raw order for mid-meeting bootstrap","expected_runtime_effect":"dead cards that existed before the meeting should no longer cause neighboring AleLudu card highlights to shift, especially around row edges","validation":"overlay/voice static checks, highlight/audio simulations including AleLudu pre-dead order checks, cosmetic simulations, npm typecheck, Vite build, and cargo check all pass","next_action_hint":"build installer and test meetings with pre-dead players; if edges still off, collect screenshot with AleLudu debug enabled and tune per-column/row calibration"}}
{"type":"config","name":"Perfect Crewlink AleLudu PlayerVoteArea meeting order","metricName":"bug_score","metricUnit":"","bestDirection":"lower"}
{"run":102,"commit":"a8b43ba","metric":1,"metrics":{"static_bug_checks":0,"simulation_failures":1,"cosmetic_failures":0,"typecheck_fail":0,"build_fail":0,"rust_check_fail":0},"status":"keep","description":"baseline for AleLudu PlayerVoteArea order source checks","timestamp":1777586479760,"segment":50,"confidence":null,"asi":{"hypothesis":"AleLudu actual layout is not raw GameData order; decompiled AleLuduMod 1.1.2 uses meetingHud.playerStates.OrderBy(p => p.AmDead). Current overlay cannot read PlayerVoteArea.AmDead and the last raw-order fix makes runtime screenshots worse.","evidence":"C:/Users/Administrator/Desktop/AleLuduMod.dll decompile shows MeetingHudBehaviour.Targets => meetingHud.playerStates.OrderBy((PlayerVoteArea p) => p.AmDead); screenshot shows raw-order build shifts highlights badly.","benchmark_change":"source check now requires overlay to preserve a pre-meeting TASKS player snapshot and use that death state for AleLudu initial order, instead of raw current DISCUSSION order","failure":"source_meeting_aleludu_initial_order_uses_premeeting_dead_state","validation":"baseline still passes typecheck, build, cargo, audio, cosmetic, and existing overlay checks","next_action_hint":"add lastTaskPlayersRef in Overlay, pass meetingStartPlayers into MeetingHud, and make AleLudu initialMeetingPlayerIds sort by pre-meeting death state when transitioning TASKS->DISCUSSION"}}
{"run":103,"commit":"007db74","metric":0,"metrics":{"static_bug_checks":0,"simulation_failures":0,"cosmetic_failures":0,"typecheck_fail":0,"build_fail":0,"rust_check_fail":0},"status":"keep","description":"use pre-meeting death snapshot for AleLudu order","timestamp":1777586586841,"segment":50,"confidence":null,"asi":{"hypothesis":"AleLudu lays out MeetingHud.playerStates sorted by PlayerVoteArea.AmDead at meeting creation. Overlay should not raw-order all players, and should not sort using current GameData.isDead after guesses/kills changed during discussion.","decompiled_evidence":"AleLuduMod 1.1.2 MeetingHudBehaviour.Targets => meetingHud.playerStates.OrderBy((PlayerVoteArea p) => p.AmDead). Start() then positions targets row-major by that sequence.","fix":"Overlay tracks last TASKS player snapshot in lastTaskPlayersRef and passes it to MeetingHud. AleLudu initialMeetingPlayerIds sorts by that pre-meeting death snapshot on TASKS->DISCUSSION, then freezes order. Mid-meeting bootstrap fallback remains raw reader order.","runtime_expectation":"Compared to 1.0.4 raw-order build, pre-dead players move back to AleLudu's AmDead-last section while players killed/guessed during the meeting no longer reshuffle later cards.","validation":"overlay/voice static checks, AleLudu premeeting-death simulation, highlight/audio simulations, cosmetic simulations, npm typecheck, Vite build, and cargo check all pass","next_action_hint":"build installer and test same screenshot scenario. If still wrong, implement direct MeetingHud.playerStates/TargetPlayerId memory read instead of approximation."}}
{"type":"config","name":"Perfect Crewlink AleLudu synchronous pre-meeting snapshot","metricName":"bug_score","metricUnit":"","bestDirection":"lower"}
{"run":104,"commit":"37f6b3e","metric":1,"metrics":{"static_bug_checks":0,"simulation_failures":1,"cosmetic_failures":0,"typecheck_fail":0,"build_fail":0,"rust_check_fail":0},"status":"keep","description":"baseline for synchronous AleLudu task snapshot capture","timestamp":1777586814306,"segment":51,"confidence":null,"asi":{"hypothesis":"lastTaskPlayersRef is currently updated in a React effect after state render. If state events arrive TASKS->DISCUSSION quickly or via overlay storage bootstrap, the first discussion render can freeze without the pre-meeting death snapshot and fall back to current/wrong ordering.","benchmark_change":"added source_meeting_task_snapshot_captured_synchronously requiring incoming TASKS states to update lastTaskPlayersRef before setGameState for bridge and storage events","failure":"source_meeting_task_snapshot_captured_synchronously","validation":"existing overlay/audio/cosmetic checks plus typecheck/build/cargo pass","next_action_hint":"add rememberTaskPlayers helper and call it before setGameState in onState and storage gameState handler; keep existing effect as fallback"}}
{"type":"config","name":"Perfect Crewlink pure Rust migration and meeting highlight correctness","metricName":"purity_highlight_score","metricUnit":"","bestDirection":"lower"}
{"run":1,"commit":"f58d741","metric":0,"metrics":{"non_rust_runtime_files":0,"non_rust_runtime_loc":0,"highlight_static_failures":0,"rust_meeting_source_failures":0,"frontend_surface_failures":0,"cargo_check_fail":0,"typecheck_fail":0,"build_fail":0},"status":"crash","description":"baseline harness crashed before metrics due Node stdin invocation bug","timestamp":1777652640037,"segment":0,"confidence":null,"asi":{"hypothesis":"new pure-Rust migration benchmark can quantify non-Rust runtime surface and highlight hardcodes","error":"Node invoked temp metrics JSON path as script instead of stdin: MODULE_NOT_FOUND","rollback_reason":"benchmark harness bug, no product code evaluated","next_action_hint":"change first node call to `node - \"$metrics_json\" <<'NODE'` and rerun baseline"}}
{"run":2,"commit":"f58d741","metric":0,"metrics":{"non_rust_runtime_files":0,"non_rust_runtime_loc":0,"highlight_static_failures":0,"rust_meeting_source_failures":0,"frontend_surface_failures":0,"cargo_check_fail":0,"typecheck_fail":0,"build_fail":0},"status":"crash","description":"baseline harness wrote metrics to wrong argv path","timestamp":1777652723942,"segment":0,"confidence":null,"asi":{"hypothesis":"pure-Rust benchmark now reaches checks but cannot emit primary metric until metrics JSON path is fixed","error":"ENOENT opening perfectcrewlink-pure-rust-metrics.json; first Node heredoc used process.argv[1] under `node -` instead of process.argv[2]","rollback_reason":"benchmark harness bug; cargo/typecheck/build likely ran but primary metric missing","next_action_hint":"set first heredoc `const outPath = process.argv[2];`, rerun baseline"}}
{"run":3,"commit":"20d94a0","metric":62540,"metrics":{"non_rust_runtime_files":66,"non_rust_runtime_loc":20940,"highlight_static_failures":7,"rust_meeting_source_failures":7,"frontend_surface_failures":7,"cargo_check_fail":0,"typecheck_fail":0,"build_fail":0},"status":"keep","description":"baseline pure-Rust migration and highlight-hardcode score","timestamp":1777652772821,"segment":0,"confidence":null,"asi":{"hypothesis":"baseline quantifies current TypeScript/React runtime surface plus missing Rust-sourced meeting HUD cards before migration","baseline_findings":"66 non-Rust runtime/config files, 20940 LOC, 7 highlight hardcode failures, 7 missing Rust meeting-source failures, 7 frontend-surface failures","validation":"cargo check, npm typecheck, and npm build pass","next_action_hint":"first improvement should add Rust MeetingHudSnapshot/MeetingHudCard state and reader stub/simulation before touching renderer layout"}}
{"type":"config","name":"Perfect Crewlink pure Rust migration and meeting highlight correctness v2","metricName":"purity_highlight_score_v2","metricUnit":"","bestDirection":"lower"}
{"run":4,"commit":"fd7dd3c","metric":62540,"metrics":{"non_rust_runtime_files":66,"non_rust_runtime_loc":20940,"highlight_static_failures":7,"rust_meeting_source_failures":7,"frontend_surface_failures":7,"cargo_check_fail":0,"typecheck_fail":0,"build_fail":0},"status":"keep","description":"valid v2 baseline for pure-Rust migration score","timestamp":1777652857721,"segment":1,"confidence":null,"asi":{"hypothesis":"v2 metric avoids crash-poisoned baseline and measures same pure-Rust/highlight migration target","baseline_findings":"66 non-Rust runtime/config files, 20940 LOC, 7 highlight hardcode failures, 7 missing Rust meeting-source failures, 7 frontend-surface failures","validation":"cargo check, npm typecheck, and npm build pass","next_action_hint":"add Rust MeetingHudSnapshot/MeetingHudCard and wire AmongUsState/TS bridge next"}}
{"run":5,"commit":"f563840","metric":48560,"metrics":{"non_rust_runtime_files":66,"non_rust_runtime_loc":20960,"highlight_static_failures":7,"rust_meeting_source_failures":0,"frontend_surface_failures":7,"cargo_check_fail":0,"typecheck_fail":0,"build_fail":0},"status":"keep","description":"add Rust meeting HUD snapshot/card schema and TS bridge","timestamp":1777653025579,"segment":1,"confidence":null,"asi":{"hypothesis":"highlight overhaul needs a Rust-owned MeetingHud card data contract before renderer can stop guessing screen slots","result":"Added MeetingHudSnapshot/MeetingHudCard to Rust state plus optional TS bridge; current reader emits player_list_fallback cards during discussion, not real card transforms yet","important_limitation":"This improves architecture only; it does not yet remove Overlay.tsx hardcoded AleLudu geometry or read actual PlayerVoteArea/card objects","validation":"cargo check, npm typecheck, and npm build pass","next_action_hint":"make renderer prefer gameState.meetingHud.cards for slot identity/visibility, then replace fallback with real meetingHud.playerStates offsets when known"}}
{"run":6,"commit":"f828863","metric":46579,"metrics":{"non_rust_runtime_files":66,"non_rust_runtime_loc":20979,"highlight_static_failures":6,"rust_meeting_source_failures":0,"frontend_surface_failures":7,"cargo_check_fail":0,"typecheck_fail":0,"build_fail":0},"status":"keep","description":"renderer prefers Rust meeting HUD cards for overlay slots","timestamp":1777653093091,"segment":1,"confidence":8.057041898031297,"asi":{"hypothesis":"slot identity should come from Rust meetingHud.cards when available, so renderer can stop deriving card/player mapping from DOM order","result":"Overlay now maps gameState.meetingHud.cards to slot placeholders/player IDs first, then falls back to old frozen-order logic; AleLudu slot count/debug measurement also uses these slots","important_limitation":"Rust cards currently use player_list_fallback order, so this still needs real PlayerVoteArea/card read before hardcoded geometry can be safely removed","validation":"cargo check, npm typecheck, and npm build pass","next_action_hint":"preserve hidden/missing slots with Rust cards, then remove AleLudu compaction fallback or gate it only when Rust meetingHud is absent"}}
