{"type":"config","name":"Perfect Crewlink overlay and voice correctness","metricName":"bug_score","metricUnit":"","bestDirection":"lower"}
{"run":1,"commit":"55ddc30","metric":0,"metrics":{"static_bug_checks":6},"status":"crash","description":"baseline script crashed because POSIX tail unavailable in harness shell","timestamp":1777490327059,"segment":0,"confidence":null,"asi":{"hypothesis":"establish baseline static bug score before code fixes","error":"./autoresearch.sh line 44: tail: command not found","rollback_reason":"benchmark harness used tail; no product code tested","next_action_hint":"replace tail with Node output truncation or omit log tail, then rerun baseline"}}
{"type":"config","name":"Perfect Crewlink overlay and voice correctness","metricName":"bug_score","metricUnit":"","bestDirection":"lower"}
{"run":2,"commit":"24493c6","metric":16,"metrics":{"static_bug_checks":6,"typecheck_fail":1},"status":"keep","description":"baseline static bug score before fixes","timestamp":1777490406930,"segment":1,"confidence":null,"asi":{"hypothesis":"baseline captures six root-cause regressions plus existing typecheck failure","baseline_static_failures":["overlay foreground hide","meeting order only AleLudu","AleLudu row count uses renderPlayers length","lobby rejoin passes clientId as playerId","WebAudio uses vertical Y axis","VAD can overwrite active socket mapping"],"typecheck_failure":"ISettings lacks debugMode while Settings/SettingsStore use it"}}
{"run":3,"commit":"24493c6","metric":0,"metrics":{"static_bug_checks":0,"typecheck_fail":0},"status":"discard","description":"all targeted bug checks passed but edit hook reformatted huge unrelated surface","timestamp":1777490723692,"segment":1,"confidence":null,"asi":{"hypothesis":"fix all six bug root causes plus ISettings debugMode type error","learned":"logic changes worked and typecheck passed, but edit hook rewrote large TS files and touched src-tauri/src/assets.rs/get_host_platform formatting","rollback_reason":"secondary code-churn risk too high for surgical bugfix despite primary metric improvement","next_action_hint":"reapply same fixes with raw byte-preserving patching, then rerun metric"}}
{"run":4,"commit":"a11b317","metric":0,"metrics":{"static_bug_checks":0,"typecheck_fail":0},"status":"keep","description":"fix overlay Alt-Tab visibility, stable meeting slots, peer mapping, and top-down audio axes","timestamp":1777490806813,"segment":1,"confidence":null,"asi":{"hypothesis":"requested bugs share six root causes: focus-based overlay hiding, meeting slot reshuffle, stale socket updates, wrong reconnect player id, vertical-axis panning, and missing debugMode type","overlay_fix":"Windows overlay now hides only when Among Us is minimized or absent, not when another app has focus","meeting_fix":"Meeting slots now use one frozen order ref for every HUD mode and AleLudu row count uses frozen slot count","voice_fix":"VAD from stale sockets cannot override active client mapping; lobby rejoin sends player id; PannerNode uses x/z top-down axes with y fixed at 0","validation":"autoresearch.sh static checks pass and npm typecheck passes"}}
{"type":"config","name":"Perfect Crewlink meeting roster growth correctness","metricName":"bug_score","metricUnit":"","bestDirection":"lower"}
{"run":5,"commit":"ebebd7f","metric":1,"metrics":{"static_bug_checks":1,"typecheck_fail":0},"status":"keep","description":"baseline for roster-growth meeting freeze check","timestamp":1777490997240,"segment":2,"confidence":null,"asi":{"hypothesis":"a meeting can render before full roster arrives, so freezing on first partial state can still misalign later talking highlights","new_check":"benchmark now requires frozenMeetingOrderRef to refresh while src.length grows, but not shrink when players disappear mid-meeting"}}
{"run":6,"commit":"1e2d05f","metric":0,"metrics":{"static_bug_checks":0,"typecheck_fail":0},"status":"keep","description":"allow frozen meeting order to grow during initial roster load","timestamp":1777491029353,"segment":2,"confidence":null,"asi":{"hypothesis":"if first discussion frame has partial players, one-shot freeze can append late players at wrong slots; recompute only while roster length increases","meeting_fix":"frozenMeetingOrderRef now updates when src.length grows, but remains frozen for same-length death updates and shrink/removal events","validation":"static checks and typecheck pass"}}
{"type":"config","name":"Perfect Crewlink duplicate socket mapping correctness","metricName":"bug_score","metricUnit":"","bestDirection":"lower"}
{"run":7,"commit":"8a57fd8","metric":1,"metrics":{"static_bug_checks":1,"typecheck_fail":0},"status":"keep","description":"baseline for duplicate client socket mapping check","timestamp":1777491145919,"segment":3,"confidence":null,"asi":{"hypothesis":"if server briefly reports duplicate socket IDs for one client, last-write mapping can bind a player's position to the wrong audio stream","new_check":"benchmark now requires explicit duplicate-client socket preference and skipping non-selected duplicate sockets"}}
{"run":8,"commit":"bbeb740","metric":0,"metrics":{"static_bug_checks":0,"typecheck_fail":0},"status":"keep","description":"dedupe duplicate client socket mappings by preferring active/previous sockets","timestamp":1777491190154,"segment":3,"confidence":null,"asi":{"hypothesis":"duplicate socket entries for one client can make audioElements for one peer get panned using another player's coordinates","voice_fix":"setClientConnectionMap now picks one socket per client, preferring active audio/peer connections and then previous socket, and skips non-selected duplicates","validation":"static checks and typecheck pass"}}
{"type":"config","name":"Perfect Crewlink TypeScript and Rust checks","metricName":"bug_score","metricUnit":"","bestDirection":"lower"}
{"run":9,"commit":"ffc201c","metric":0,"metrics":{"static_bug_checks":0,"typecheck_fail":0,"rust_check_fail":0},"status":"keep","description":"add Rust cargo check to autoresearch validation baseline","timestamp":1777491309431,"segment":4,"confidence":null,"asi":{"hypothesis":"Rust overlay changes need compiler coverage, not just TypeScript/static checks","validation":"cargo check and npm typecheck both pass on current fixes","next_action_hint":"future Rust overlay z-order changes will be caught by benchmark"}}
{"type":"config","name":"Perfect Crewlink voice connect identity correctness","metricName":"bug_score","metricUnit":"","bestDirection":"lower"}
{"run":10,"commit":"e0ff4f1","metric":2,"metrics":{"static_bug_checks":2,"typecheck_fail":0,"rust_check_fail":0},"status":"keep","description":"baseline for voice connect identity refresh checks","timestamp":1777491442209,"segment":5,"confidence":null,"asi":{"hypothesis":"initial lobby join can happen before myPlayer id is known; if the effect does not rerun and same-lobby connect does not refresh id, server can keep stale player identity","new_checks":["same-lobby connect emits id with current player/client identity","connect effect dependency list tracks myPlayer id and gameState clientId"]}}
{"run":11,"commit":"2ea5992","metric":0,"metrics":{"static_bug_checks":0,"typecheck_fail":0,"rust_check_fail":0},"status":"keep","description":"refresh voice server identity when player id becomes available","timestamp":1777491478103,"segment":5,"confidence":null,"asi":{"hypothesis":"server identity can remain stale after early same-lobby connect; stale identities can cascade into wrong peer/player mapping and spatial audio","voice_fix":"same-lobby connect now emits current id when playerId/clientId are valid; connect effect reruns when myPlayer id or clientId changes","validation":"static checks, npm typecheck, and cargo check pass"}}
{"type":"config","name":"Perfect Crewlink dead-state overlay correctness","metricName":"bug_score","metricUnit":"","bestDirection":"lower"}
{"run":12,"commit":"27e5fc0","metric":1,"metrics":{"static_bug_checks":1,"typecheck_fail":0,"rust_check_fail":0},"status":"keep","description":"baseline for otherDead live player update check","timestamp":1777491676667,"segment":6,"confidence":null,"asi":{"hypothesis":"otherDead only updates on gameState transitions; mid-meeting deaths/disconnects can leave overlay/voice dead metadata stale and contribute to wrong highlight/sort behavior","new_check":"Voice dead-state effect must depend on gameState.players and avoid re-render churn with changed guard"}}
{"run":13,"commit":"1321ce8","metric":0,"metrics":{"static_bug_checks":0,"typecheck_fail":0,"rust_check_fail":0},"status":"keep","description":"keep otherDead synchronized with live player updates","timestamp":1777491719649,"segment":6,"confidence":null,"asi":{"hypothesis":"stale dead/disconnect state can make overlays sort/filter/highlight players incorrectly during meetings","voice_fix":"otherDead effect now tracks gameState.players, removes vanished clients, and returns old state when nothing changed to avoid churn","validation":"static checks, npm typecheck, and cargo check pass"}}
{"type":"config","name":"Perfect Crewlink camera audio guard correctness","metricName":"bug_score","metricUnit":"","bestDirection":"lower"}
{"run":14,"commit":"87627e5","metric":1,"metrics":{"static_bug_checks":1,"typecheck_fail":0,"rust_check_fail":0},"status":"keep","description":"baseline for missing camera-position guard","timestamp":1777491816889,"segment":7,"confidence":null,"asi":{"hypothesis":"hear-through-cameras can index a missing camera position on maps/mods without camera metadata, crashing or leaving positional audio wrong","new_check":"calculateVoiceAudio must use safe cameras lookup and bail when selected camera position is missing"}}
{"run":15,"commit":"5ad3650","metric":0,"metrics":{"static_bug_checks":0,"typecheck_fail":0,"rust_check_fail":0},"status":"keep","description":"guard proximity camera audio against missing camera metadata","timestamp":1777491852379,"segment":7,"confidence":null,"asi":{"hypothesis":"missing camera metadata can crash or misposition hear-through-cameras audio, especially on modded maps","voice_fix":"calculateVoiceAudio now uses safe camera map lookup, returns silence for missing selected camera, and reuses safe camera collection for Skeld nearest-camera search","validation":"static checks, npm typecheck, and cargo check pass"}}
{"type":"config","name":"Perfect Crewlink full build validation","metricName":"bug_score","metricUnit":"","bestDirection":"lower"}
{"run":16,"commit":"f85ab45","metric":0,"metrics":{"static_bug_checks":0,"typecheck_fail":0,"build_fail":0,"rust_check_fail":0},"status":"keep","description":"add full Vite build to validation baseline","timestamp":1777491974784,"segment":8,"confidence":null,"asi":{"hypothesis":"fixes should pass production frontend build, not only typecheck/static checks","validation":"npm run build, npm run typecheck, cargo check, and static checks all pass"}}
{"type":"config","name":"Perfect Crewlink talking highlight stale VAD guard","metricName":"bug_score","metricUnit":"","bestDirection":"lower"}
{"run":17,"commit":"cd84e61","metric":1,"metrics":{"static_bug_checks":1,"typecheck_fail":0,"build_fail":0,"rust_check_fail":0},"status":"keep","description":"baseline for stale VAD talking highlight guard","timestamp":1777492124427,"segment":9,"confidence":null,"asi":{"hypothesis":"server VAD true can outlive audible remote audio and keep wrong meeting/player highlight active","new_check":"talking state should combine VAD with recent audio monitor activity via REMOTE_AUDIO_TALKING_GRACE_MS/serverVadTalking"}}
{"run":18,"commit":"fa7d2a7","metric":0,"metrics":{"static_bug_checks":0,"typecheck_fail":0,"build_fail":0,"rust_check_fail":0},"status":"keep","description":"gate remote talking highlights with recent audio activity","timestamp":1777492167306,"segment":9,"confidence":null,"asi":{"hypothesis":"stale server VAD can keep the wrong player highlighted even after audio has gone silent","voice_fix":"talking state now uses recent audio activity window for VAD-backed highlights while still allowing first VAD before monitor state exists","validation":"static checks, npm typecheck, npm build, and cargo check pass"}}
{"type":"config","name":"Perfect Crewlink overlay hidden visibility refresh","metricName":"bug_score","metricUnit":"","bestDirection":"lower"}
{"run":19,"commit":"af49c33","metric":1,"metrics":{"static_bug_checks":1,"typecheck_fail":0,"build_fail":0,"rust_check_fail":0},"status":"keep","description":"baseline for overlay visibilitychange hidden-state refresh","timestamp":1777492353185,"segment":10,"confidence":null,"asi":{"hypothesis":"if the overlay webview visibilityState becomes hidden during Alt-Tab, visible-only visibilitychange handlers can miss resize/bootstrap refreshes","new_check":"Overlay.tsx should refresh size/init on every visibilitychange, not only when document.visibilityState is visible"}}
{"run":20,"commit":"2729534","metric":0,"metrics":{"static_bug_checks":0,"typecheck_fail":0,"build_fail":0,"rust_check_fail":0},"status":"keep","description":"refresh overlay size and bootstrap on every visibilitychange","timestamp":1777492393010,"segment":10,"confidence":null,"asi":{"hypothesis":"Alt-Tab can make overlay webview hidden without native window hiding; visible-gated handlers delayed state/size refresh until focus returned","overlay_fix":"visibilitychange now always refreshes window size and requests main-window bootstrap state","validation":"static checks, npm typecheck, npm build, and cargo check pass"}}
{"run":21,"commit":"2729534","metric":0,"metrics":{"static_bug_checks":0,"typecheck_fail":0,"build_fail":0,"rust_check_fail":0},"status":"crash","description":"attempted custom lint command blocked by autoresearch harness","timestamp":1777492415940,"segment":10,"confidence":null,"asi":{"hypothesis":"wanted extra lint validation","error":"run_experiment refused custom command because autoresearch.sh exists","rollback_reason":"no product code was changed or evaluated","next_action_hint":"add lint to autoresearch.sh before running if lint validation is needed"}}
{"type":"config","name":"Perfect Crewlink meeting roster append stability","metricName":"bug_score","metricUnit":"","bestDirection":"lower"}
{"run":22,"commit":"a7711a0","metric":1,"metrics":{"static_bug_checks":1,"typecheck_fail":0,"build_fail":0,"rust_check_fail":0},"status":"keep","description":"baseline for meeting roster-growth append stability","timestamp":1777492802798,"segment":11,"confidence":null,"asi":{"hypothesis":"recomputing the frozen meeting order when roster length grows can reshuffle existing slots if death/disconnect state changed before the full roster arrived","review_finding":"reviewer flagged Overlay.tsx roster-growth recompute as medium severity","new_check":"frozen meeting order growth should append missing players without reordering existing frozen IDs"}}
{"run":23,"commit":"f7557c7","metric":0,"metrics":{"static_bug_checks":0,"typecheck_fail":0,"build_fail":0,"rust_check_fail":0},"status":"keep","description":"append late meeting roster entries without reshuffling frozen slots","timestamp":1777492850388,"segment":11,"confidence":null,"asi":{"hypothesis":"roster growth should not recompute earlier frozen slots after deaths/disconnects, or highlights can shift to wrong cards","meeting_fix":"extracted sortedMeetingPlayerIds and appendMissingMeetingPlayers; existing frozen ids remain in order and only new ids append","validation":"static checks, npm typecheck, npm build, and cargo check pass"}}
{"type":"config","name":"Perfect Crewlink meeting removed-player placeholders","metricName":"bug_score","metricUnit":"","bestDirection":"lower"}
{"run":24,"commit":"9a3db29","metric":1,"metrics":{"static_bug_checks":1,"typecheck_fail":0,"build_fail":0,"rust_check_fail":0},"status":"keep","description":"baseline for missing-player meeting placeholders","timestamp":1777492976370,"segment":12,"confidence":null,"asi":{"hypothesis":"when a player entry disappears mid-meeting, non-AleLudu flex overlays shift later highlight boxes without placeholder slots","review_finding":"reviewer flagged missing placeholders for old/non-AleLudu HUD as medium severity","new_check":"meeting overlay should render null-player placeholders for missing frozen slots"}}
{"run":25,"commit":"abbf9b2","metric":0,"metrics":{"static_bug_checks":0,"typecheck_fail":0,"build_fail":0,"rust_check_fail":0},"status":"keep","description":"render invisible placeholders for missing frozen meeting slots","timestamp":1777493028532,"segment":12,"confidence":null,"asi":{"hypothesis":"non-AleLudu flex meeting overlays need invisible placeholders to keep later cards from shifting when a player disappears mid-meeting","meeting_fix":"overlaySlots now include Player|null entries; old/non-AleLudu HUD renders meetingPlaceholder divs for missing frozen ids while AleLudu keeps absolute positioning","validation":"static checks, npm typecheck, npm build, and cargo check pass"}}
{"type":"config","name":"Perfect Crewlink talking state disconnect correctness","metricName":"bug_score","metricUnit":"","bestDirection":"lower"}
{"run":26,"commit":"928e76b","metric":2,"metrics":{"static_bug_checks":2,"typecheck_fail":0,"build_fail":0,"rust_check_fail":0},"status":"keep","description":"baseline for talking state disconnect review findings","timestamp":1777493327048,"segment":13,"confidence":null,"asi":{"hypothesis":"review found stale/wrong talking highlights can persist when VAD lacks audio monitor state or when audio disappears while otherTalking remains true","review_findings":["server VAD path still allowed !remoteAudioState","otherTalking only updated inside if(audio)"],"new_checks":["serverVadTalking must not use !remoteAudioState","loop must clear tempTalking when audio is missing"]}}
{"run":27,"commit":"db94e58","metric":0,"metrics":{"static_bug_checks":0,"typecheck_fail":0,"build_fail":0,"rust_check_fail":0},"status":"keep","description":"prevent stale VAD and missing audio from keeping players highlighted","timestamp":1777493371923,"segment":13,"confidence":null,"asi":{"hypothesis":"wrong meeting highlights can persist if server VAD has no current audio evidence or audio is gone but otherTalking stays true","voice_fix":"serverVadTalking now requires remoteAudioState plus recent/active audio; player loop clears tempTalking when no audio element exists","validation":"static checks, npm typecheck, npm build, and cargo check pass"}}
{"type":"config","name":"Perfect Crewlink overlay foreground cleanup","metricName":"bug_score","metricUnit":"","bestDirection":"lower"}
{"run":28,"commit":"c619c69","metric":1,"metrics":{"static_bug_checks":1,"typecheck_fail":0,"build_fail":0,"rust_check_fail":0},"status":"keep","description":"baseline for unused overlay foreground state cleanup","timestamp":1777493563952,"segment":14,"confidence":null,"asi":{"hypothesis":"after removing foreground-gated hiding, Rust foreground tracking is unused and creates cargo warnings/noise","review_finding":"reviewer flagged unused is_foreground as low severity","new_check":"overlay window state should no longer contain is_foreground/GetForegroundWindow"}}
{"run":29,"commit":"d120d14","metric":0,"metrics":{"static_bug_checks":0,"typecheck_fail":0,"build_fail":0,"rust_check_fail":0},"status":"keep","description":"remove unused foreground tracking from overlay window scan","timestamp":1777493608774,"segment":14,"confidence":null,"asi":{"hypothesis":"foreground status is no longer used and should be removed to avoid warning/noise after Alt-Tab behavior change","overlay_fix":"removed is_foreground field, GetForegroundWindow import/use, and SearchResult foreground storage","validation":"static checks, npm typecheck, npm build, and cargo check pass"}}
{"type":"config","name":"Perfect Crewlink meeting same-length replacement slots","metricName":"bug_score","metricUnit":"","bestDirection":"lower"}
{"run":30,"commit":"15e9072","metric":1,"metrics":{"static_bug_checks":1,"typecheck_fail":0,"build_fail":0,"rust_check_fail":0},"status":"keep","description":"baseline for same-length meeting replacement slots","timestamp":1777493796369,"segment":15,"confidence":null,"asi":{"hypothesis":"if a frozen player vanishes and a new player appears with the same roster length, placeholder logic can omit the new player because growth condition is length-only","review_finding":"reviewer flagged same-length replacement as low severity","new_check":"frozen meeting order update should detect missing current player ids, not only src.length growth"}}
{"run":31,"commit":"a89e3f2","metric":0,"metrics":{"static_bug_checks":0,"typecheck_fail":0,"build_fail":0,"rust_check_fail":0},"status":"keep","description":"append same-length replacement players to frozen meeting order","timestamp":1777493843740,"segment":15,"confidence":null,"asi":{"hypothesis":"new player ids can appear without roster length growing, so slot order should detect missing ids directly","meeting_fix":"added hasMissingMeetingPlayers; frozen order appends missing current players while preserving prior ids/placeholders","validation":"static checks, npm typecheck, npm build, and cargo check pass"}}
{"type":"config","name":"Perfect Crewlink embedded child overlay","metricName":"bug_score","metricUnit":"","bestDirection":"lower"}
{"run":32,"commit":"bc59fc1","metric":1,"metrics":{"static_bug_checks":1,"typecheck_fail":0,"build_fail":0,"rust_check_fail":0},"status":"keep","description":"baseline for embedding overlay as Among Us child window","timestamp":1777504684249,"segment":16,"confidence":null,"asi":{"hypothesis":"top-level always-on-top overlay covers taskbar and appears outside Among Us; embedding as child window should clip it to Among Us client area","user_feedback":"overlay shows outside Among Us and hides/covers taskbar until app closes","new_check":"Rust overlay code must use SetParent, WS_CHILD, and GetClientRect"}}
