{"run":77,"commit":"e5b14ac","metric":6,"metrics":{"static_bug_checks":0,"simulation_failures":0,"cosmetic_failures":6,"typecheck_fail":0,"build_fail":0,"rust_check_fail":0},"status":"keep","description":"baseline for TOU Mira cosmetic icon resolver","timestamp":1777525134920,"segment":38,"confidence":null,"asi":{"hypothesis":"TOU Mira and current Among Us cosmetic ids can differ from BetterCrewLink-Hats keys, especially skin/clothes suffixes and asset_name values; exact-only hat lookup plus no skin/visor type handling can hide custom clothes/skins in avatar icons","simulation_added":"scripts/simulate-cosmetics.mjs checks for skin/visor cosmetic types, avatar using type-specific skin/visor lookups, alias resolution using asset_name/image, cosmetic-kind filtering, active-mod preference, and skin suffix aliases","evidence":"BetterCrewLink-Hats contains TOWN_OF_US_MIRA hats only and vanilla MIRA skins/visors under NONE with keys like skin_Hazmat-Blueskin and asset names; exact ids without suffix can miss","validation":"baseline still passes existing overlay/voice static checks, highlight/audio simulations, typecheck, build, and cargo check","next_action_hint":"implement alias-aware cosmetic resolver in src/renderer/cosmetics.ts and update Avatar.tsx to request cosmeticType.skin and cosmeticType.visor with typed dimensions"}}
{"run":78,"commit":"fa19c0f","metric":1,"metrics":{"static_bug_checks":0,"simulation_failures":0,"cosmetic_failures":1,"typecheck_fail":0,"build_fail":0,"rust_check_fail":0},"status":"keep","description":"add typed alias-aware cosmetic resolver","timestamp":1777525307165,"segment":38,"confidence":null,"asi":{"hypothesis":"TOU Mira/Among Us custom clothes and skins fail to render when player cosmetic ids are valid but do not exactly match BetterCrewLink-Hats JSON keys; typed alias matching by key, asset_name, and image basename should recover them","cosmetic_fix":"cosmetics.ts now has skin and visor cosmetic types, active-mod-first fallback, hat_type filtering, and normalized alias lookup that strips prefixes and trailing skin suffixes; Avatar.tsx now requests skin/visor-specific cosmetics and dimensions","remaining_issue":"cosmetic_failures=1 because source_cosmetics_prefers_active_mod_before_vanilla_fallback check expects single quotes while formatter emitted double quotes; source behavior is correct","validation":"existing overlay/voice static checks, highlight/audio simulations, npm typecheck, Vite build, and cargo check pass","next_action_hint":"make cosmetic simulation quote-tolerant and rerun to confirm bug_score 0"}}
{"run":79,"commit":"04d9a94","metric":0,"metrics":{"static_bug_checks":0,"simulation_failures":0,"cosmetic_failures":0,"typecheck_fail":0,"build_fail":0,"rust_check_fail":0},"status":"keep","description":"make cosmetic resolver simulation quote tolerant","timestamp":1777525361057,"segment":38,"confidence":null,"asi":{"hypothesis":"cosmetic resolver fix is complete; remaining failure was a brittle simulation regex that assumed single quotes instead of accepting formatter output","test_fix":"source_cosmetics_prefers_active_mod_before_vanilla_fallback now accepts either single or double quotes around NONE while still requiring active mod before vanilla fallback","validation":"existing overlay/voice static checks, highlight/audio simulations, cosmetic simulations, npm typecheck, Vite build, and cargo check all pass","next_action_hint":"address pi-lens concern by reviewing typed getHatDementions and getCosmetic call sites; if no more diagnostics, run installer build for user testing with TOU Mira cosmetics"}}
{"type":"config","name":"Perfect Crewlink current outfit cosmetics for TOU Mira icons","metricName":"bug_score","metricUnit":"","bestDirection":"lower"}
{"run":80,"commit":"ff9a391","metric":0,"metrics":{"static_bug_checks":0,"simulation_failures":0,"cosmetic_failures":0,"typecheck_fail":0,"build_fail":0,"rust_check_fail":0},"status":"keep","description":"baseline attempt for current outfit cosmetic checks","timestamp":1777525563743,"segment":39,"confidence":null,"asi":{"hypothesis":"currentOutfit-specific skin/hat/visor fields may not be read, causing TOU Mira visible/custom clothes to be missing from player icons","simulation_added":"added source_current_outfit_cosmetics_ts and source_current_outfit_cosmetics_rust checks","finding":"initial regex was too broad and passed by matching default-outfit cosmetic reads before the currentOutfit branch, so it did not detect the intended root cause","next_action_hint":"tighten checks to isolate the currentOutfit branch before re-running baseline"}}
{"type":"config","name":"Perfect Crewlink current outfit cosmetics isolated checks","metricName":"bug_score","metricUnit":"","bestDirection":"lower"}
{"run":81,"commit":"24fcb46","metric":2,"metrics":{"static_bug_checks":0,"simulation_failures":0,"cosmetic_failures":2,"typecheck_fail":0,"build_fail":0,"rust_check_fail":0},"status":"keep","description":"baseline with isolated current outfit cosmetic checks","timestamp":1777525635711,"segment":40,"confidence":null,"asi":{"hypothesis":"TOU Mira can put visible cosmetics on the current outfit entry, but readers only copy hat/skin/visor from outfit key 0; player icons can therefore miss custom clothes/skins","simulation_added":"cosmetic simulation now slices the currentOutfit branch in both src/main/GameReader.ts and src-tauri/src/game_session.rs and requires hat/skin/visor reads inside that branch","failure":"both TS and Rust readers only read shiftedColor from currentOutfit branch","next_action_hint":"copy current outfit hat/skin/visor into parsed player cosmetic fields when key matches currentOutfit, while keeping identity color/name unchanged"}}
{"type":"config","name":"Perfect Crewlink vision-gated immersive audio","metricName":"bug_score","metricUnit":"","bestDirection":"lower"}
{"run":82,"commit":"fbec150","metric":3,"metrics":{"static_bug_checks":0,"simulation_failures":3,"cosmetic_failures":0,"typecheck_fail":0,"build_fail":0,"rust_check_fail":0},"status":"keep","description":"baseline for vision-gated immersive audio regressions","timestamp":1777581356731,"segment":41,"confidence":null,"asi":{"hypothesis":"vision hearing still allows audio outside vision because impostors bypass light radius and radius is padded; muffling filter Q values can cause buzzing/static; directional focus can be sharpened with explicit focus/rolloff settings","simulation_added":"added vision-radius source check, non-resonant muffle Q source check, and directional focus/rolloff source check to simulate-highlight-audio.mjs","failures":"source_audio_vision_hearing_caps_to_light_radius, source_audio_muffle_q_is_non_resonant, source_audio_directional_focus_configured","validation":"baseline still passes existing overlay/voice static checks, highlight/audio simulations, cosmetic simulations, npm typecheck, Vite build, and cargo check","next_action_hint":"update Voice.tsx maxDistanceRef to Math.min(maxDistance, lightRadius) for vision hearing, remove +0.5 and impostor bypass, replace resonant/negative Q values with AUDIO_MUFFLE_Q, and add focus/rolloff constants"}}
{"run":83,"commit":"c6936d2","metric":0,"metrics":{"static_bug_checks":0,"simulation_failures":0,"cosmetic_failures":0,"typecheck_fail":0,"build_fail":0,"rust_check_fail":0},"status":"keep","description":"tighten vision hearing and reduce audio artifacts","timestamp":1777581439972,"segment":41,"confidence":null,"asi":{"hypothesis":"vision-only hearing should hard-cap by light radius for all roles; resonant/negative muffle filter Q can create buzzing/static; stronger panner focus and rolloff can make directional audio feel more precise","audio_fix":"Voice.tsx now uses Math.min(lobbySettings.maxDistance, gameState.lightRadius) when visionHearing is enabled, removes impostor bypass and +0.5 padding, avoids minimum-distance clamp under vision hearing, replaces radio/vent/camera muffle Q with AUDIO_MUFFLE_Q=0.8, and adds AUDIO_DIRECTIONAL_FOCUS plus AUDIO_DISTANCE_ROLLOFF_FACTOR=1.25","expected_runtime_effect":"players outside current vision radius should be muted; muffle transitions should ring less; HRTF spatialization should feel more focused with slightly stronger rolloff","validation":"overlay/voice static checks, highlight/audio simulations, cosmetic simulations, npm typecheck, Vite build, and cargo check all pass","next_action_hint":"runtime-test with vision hearing enabled as both crewmate and impostor; if buzzing persists, inspect overlapping reverb/muffle applyEffect paths and consider separate effect routing"}}
{"type":"config","name":"Perfect Crewlink stable audio effect chain","metricName":"bug_score","metricUnit":"","bestDirection":"lower"}
{"run":84,"commit":"dd233a1","metric":1,"metrics":{"static_bug_checks":0,"simulation_failures":1,"cosmetic_failures":0,"typecheck_fail":0,"build_fail":0,"rust_check_fail":0},"status":"keep","description":"baseline for stable audio effect chain","timestamp":1777581618494,"segment":42,"confidence":null,"asi":{"hypothesis":"buzzing/static can come from applyEffect/restoreEffect mutating partial WebAudio routes; if muffle and reverb overlap or disconnect throws, gain can duplicate, bypass, or drop paths","simulation_added":"source_audio_rebuilds_single_effect_chain requires a centralized updateAudioEffectChain that disconnects gain/muffle/reverb and rebuilds exactly one chain from active flags","failure":"Voice.tsx still uses applyEffect and restoreEffect to incrementally connect/disconnect effects","validation":"baseline still passes overlay/voice static checks, highlight/audio simulations except new effect-chain check, cosmetic simulations, typecheck, build, and cargo check","next_action_hint":"replace applyEffect/restoreEffect with updateAudioEffectChain(audio, player) and call it after muffleConnected/reverbConnected flag changes"}}
{"run":85,"commit":"5253b95","metric":0,"metrics":{"static_bug_checks":0,"simulation_failures":0,"cosmetic_failures":0,"typecheck_fail":0,"build_fail":0,"rust_check_fail":0},"status":"keep","description":"rebuild audio effect chain from active flags","timestamp":1777581787381,"segment":42,"confidence":null,"asi":{"hypothesis":"incremental applyEffect/restoreEffect calls can leave duplicated, bypassed, or missing WebAudio routes when muffle and reverb states overlap, causing static/glitchy voice output","audio_fix":"replaced applyEffect/restoreEffect with updateAudioEffectChain(audio, player), which disconnects gain/muffle/reverb outputs and rebuilds exactly one serial chain based on muffleConnected and reverbConnected flags","effect_order":"gain -> optional muffle -> optional reverb -> destination","validation":"overlay/voice static checks, highlight/audio simulations including new effect-chain check, cosmetic simulations, npm typecheck, Vite build, and cargo check all pass","next_action_hint":"runtime-test buzzing/static with vent, camera, radio, and haunting cases; if artifacts remain, inspect analyser/source graph and consider reusing one AudioContext instead of one context per peer"}}
{"type":"config","name":"Perfect Crewlink mid-meeting bootstrap and muffle artifacts","metricName":"bug_score","metricUnit":"","bestDirection":"lower"}
{"run":86,"commit":"e199005","metric":3,"metrics":{"static_bug_checks":0,"simulation_failures":3,"cosmetic_failures":0,"typecheck_fail":0,"build_fail":0,"rust_check_fail":0},"status":"keep","description":"baseline for mid-meeting bootstrap highlights and muffle artifacts","timestamp":1777582374817,"segment":43,"confidence":null,"asi":{"hypothesis":"starting the app mid-meeting after guesses/deaths bootstraps overlay order from current dead state and stale persisted voice booleans; static can persist because radio highpass and vent/camera lowpass share one BiquadFilter and switch type","user_evidence":"screenshot shows meeting already in progress with guessed/dead players interleaved; overlay was highlighting wrong people after startup mid-meeting and audio still buzzed/static/glitched","simulation_added":"source checks for mid-round reader-order bootstrap, fresh voice-state requirement for meeting highlights, and separate radio/environment muffle filters","failures":"source_meeting_bootstrap_uses_reader_order_when_mid_round, source_meeting_highlight_requires_fresh_voice_state, source_audio_separates_radio_and_environment_muffle","validation":"baseline passes existing static checks, existing simulations, cosmetic checks, typecheck, build, and cargo check","next_action_hint":"initialize meeting order from raw reader order when first observed discussion did not transition from tasks; require fresh lastSeenAt/lastAudioAt for talking highlights; split radioMuffle highpass from environment muffle lowpass"}}
{"run":87,"commit":"abe4f36","metric":0,"metrics":{"static_bug_checks":0,"simulation_failures":0,"cosmetic_failures":0,"typecheck_fail":0,"build_fail":0,"rust_check_fail":0},"status":"keep","description":"fix mid-meeting bootstrap highlights and split muffles","timestamp":1777582553423,"segment":43,"confidence":null,"asi":{"hypothesis":"wrong highlights after starting mid-meeting come from sorting by current dead flags instead of meeting-start/raw slot order and trusting stale persisted voice booleans; remaining buzzing can come from using one BiquadFilter for both radio highpass and vent/camera lowpass","overlay_fix":"initial meeting order now uses raw game reader player order when first observed discussion did not transition from TASKS, so mid-round app startup after guesses/deaths does not reshuffle cards by current dead state; meeting and avatar overlays require fresh lastSeenAt/lastAudioAt before honoring otherTalking","audio_fix":"Voice.tsx now has separate radioMuffle highpass and environment muffle lowpass nodes with independent connected flags, and updateAudioEffectChain rebuilds gain -> optional radioMuffle -> optional muffle -> optional reverb -> destination","validation":"overlay/voice static checks, highlight/audio simulations including new mid-meeting/stale voice/separate filter checks, cosmetic simulations, npm typecheck, Vite build, and cargo check all pass","next_action_hint":"build installer and runtime-test by launching app mid-meeting after guessed/dead players; test radio while in vents/camera to verify buzz/static is gone"}}
{"type":"config","name":"Perfect Crewlink AleLudu slot compaction and clickless muffle chain","metricName":"bug_score","metricUnit":"","bestDirection":"lower"}
{"run":88,"commit":"13b65c2","metric":2,"metrics":{"static_bug_checks":0,"simulation_failures":2,"cosmetic_failures":0,"typecheck_fail":0,"build_fail":0,"rust_check_fail":0},"status":"keep","description":"baseline for AleLudu slot compaction and clickless muffles","timestamp":1777583033959,"segment":44,"confidence":null,"asi":{"hypothesis":"meeting highlights are now correct speakers but shifted onto later cards after AleLudu compacts missing/guessed slots while overlay preserves placeholder slot indices; remaining static comes from disconnect/reconnect when toggling muffle filters","user_evidence":"screenshot shows colored glows matching likely speaking player colors but drawn one slot after the visible card, consistent with an invisible frozen placeholder; audio buzz is reduced but not gone after separate filters","simulation_added":"source_meeting_aleludu_compacts_missing_slots and source_audio_keeps_muffles_in_permanent_chain","failures":"source_meeting_aleludu_compacts_missing_slots, source_audio_keeps_muffles_in_permanent_chain","validation":"baseline passes existing checks plus typecheck/build/cargo","next_action_hint":"for AleLudu, compact missing slots by using render index while keeping frozen render order; keep radio/environment muffle filters in a permanent gain->radioMuffle->muffle chain and neutralize filters instead of reconnecting on muffle toggles"}}
{"run":89,"commit":"91a4f12","metric":0,"metrics":{"static_bug_checks":0,"simulation_failures":0,"cosmetic_failures":0,"typecheck_fail":0,"build_fail":0,"rust_check_fail":0},"status":"keep","description":"compact AleLudu slots and keep muffle filters connected","timestamp":1777583184131,"segment":44,"confidence":null,"asi":{"hypothesis":"AleLudu compacts missing guessed/removed slots while overlay preserved frozen placeholder indices, shifting speaking glows onto later cards; remaining audio glitches come from disconnecting/reconnecting muffle filters when entering/exiting radio, vents, or cameras","overlay_fix":"AleLudu meeting overlays now use the compact render index for absolute card positions while retaining frozen render order; legacy/non-AleLudu meeting overlays still use placeholder slots","audio_fix":"radioMuffle and environment muffle filters stay in a permanent gain -> radioMuffle -> muffle chain; disabling a muffle now smooths its filter to a neutral frequency instead of rebuilding the graph, leaving updateAudioEffectChain only for reverb routing","validation":"overlay/voice static checks, highlight/audio simulations including AleLudu compaction and permanent muffle chain checks, cosmetic simulations, npm typecheck, Vite build, and cargo check all pass","next_action_hint":"build installer and test same meeting screenshot scenario; if static remains, next target is reverb Convolver reconnect or HRTF panner movement smoothing/noise thresholds"}}
{"type":"config","name":"Perfect Crewlink output limiter for buzzing audio","metricName":"bug_score","metricUnit":"","bestDirection":"lower"}
{"run":90,"commit":"7f4edc9","metric":1,"metrics":{"static_bug_checks":0,"simulation_failures":1,"cosmetic_failures":0,"typecheck_fail":0,"build_fail":0,"rust_check_fail":0},"status":"keep","description":"baseline for output limiter buzzing check","timestamp":1777583547300,"segment":45,"confidence":null,"asi":{"hypothesis":"remaining buzzing/static may be output clipping when master volume, per-player volume, ghost volume, or multiple effects push WebAudio gain above full scale","user_evidence":"buzzing reduced after muffle graph fixes but persists, suggesting distortion/clipping rather than only filter reconnect artifacts","simulation_added":"source_audio_has_output_limiter requires a DynamicsCompressor output limiter before destination","failure":"Voice.tsx has no output limiter/compressor in the remote playback chain","validation":"baseline passes existing checks plus typecheck/build/cargo","next_action_hint":"add a DynamicsCompressor limiter after muffle/reverb chain and before MediaStreamDestination to catch clipped peaks without changing protocol"}}
{"run":91,"commit":"7f4edc9","metric":1,"metrics":{"static_bug_checks":0,"simulation_failures":1,"cosmetic_failures":0,"typecheck_fail":0,"build_fail":0,"rust_check_fail":0},"status":"discard","description":"attempt output limiter but permanent-chain check expected direct destination","timestamp":1777583622962,"segment":45,"confidence":null,"asi":{"hypothesis":"output limiter should reduce clipping-related buzzing by compressing peaks before playback","attempted_fix":"added DynamicsCompressor limiter after the remote effect chain and before MediaStreamDestination","rollback_reason":"primary metric did not improve because existing source_audio_keeps_muffles_in_permanent_chain check was over-specific and still expected muffle.connect(destination), even though limiter correctly sits between muffle and destination","failure":"source_audio_keeps_muffles_in_permanent_chain","validation":"typecheck/build/cargo still passed, source_audio_has_output_limiter passed","next_action_hint":"relax permanent-chain check to allow muffle -> limiter -> destination, rerun baseline, then reapply limiter"}}
{"run":92,"commit":"c805f86","metric":1,"metrics":{"static_bug_checks":0,"simulation_failures":1,"cosmetic_failures":0,"typecheck_fail":0,"build_fail":0,"rust_check_fail":0},"status":"keep","description":"baseline with limiter-compatible permanent-chain check","timestamp":1777583741927,"segment":45,"confidence":null,"asi":{"hypothesis":"remaining buzzing/static may be output clipping; previous limiter attempt was blocked by an over-specific permanent-chain check that assumed no limiter between muffle and destination","benchmark_fix":"source_audio_keeps_muffles_in_permanent_chain now accepts muffle -> limiter -> destination as still permanent; source_audio_has_output_limiter remains the only failure","failure":"source_audio_has_output_limiter","validation":"baseline passes static checks, simulations except output limiter, cosmetic checks, typecheck, build, and cargo check","next_action_hint":"add DynamicsCompressor limiter after remote effect chain before MediaStreamDestination"}}
{"run":93,"commit":"a2183cd","metric":0,"metrics":{"static_bug_checks":0,"simulation_failures":0,"cosmetic_failures":0,"typecheck_fail":0,"build_fail":0,"rust_check_fail":0},"status":"keep","description":"add output limiter to remote audio chain","timestamp":1777583807427,"segment":45,"confidence":null,"asi":{"hypothesis":"remaining buzzing/static is likely clipping from boosted remote voices or combined effects exceeding full-scale output; a fast limiter before playback should catch peaks without muting normal speech","audio_fix":"added a DynamicsCompressor limiter after the remote effect chain and before MediaStreamDestination; both initial permanent chain and updateAudioEffectChain now route muffle/reverb output through limiter -> destination","limiter_settings":"threshold=-8dB, knee=6, ratio=20, attack=0.003s, release=0.08s","validation":"overlay/voice static checks, highlight/audio simulations including limiter check, cosmetic simulations, npm typecheck, Vite build, and cargo check all pass","next_action_hint":"runtime-test loud speakers, radio, vents/camera, and haunting; if buzzing remains, next target should disable/reduce reverb Convolver or remove HRTF panner coloration for muffled/radio paths"}}
